id,book,source_file,source_chapter,source_text,wisdom_title,wisdom_text,theme_tags
QWQS101,《千秋万岁乌鸦求是合集》,131.梁肃戎夫人曾被日本特务当面轮奸.txt,梁肃戎夫人曾被日本特务当面轮奸,"国民党几百万党员中，老枝也好、新叶也罢，他们成为党员，大多是坐享其成的机会主义者和投机分子，不过是温室中的金枝玉叶，很少经过冒险犯难的浩劫。但是梁肃戎却不然。梁肃戎加入国民党的时候，是在敌人铁蹄下加入的，那种情况下加入国民党，是犯法的，是玩命的，是前途有限、后患无穷的，是一点好处都没有的，是不靠国民党奶水长大反而给国民党奶水的。但是梁肃戎以十九岁的年纪，毅然加入了，并且立刻展开地下工作。他在日本鬼子统治下的东北长春，秘密接受了国民党吉林省党部主任委员石坚等人的领导，担任长春市党部书记长。长春市那时正是伪满洲国的首都，地位重要，梁肃戎以地方检察厅检察官的身分做掩护，从事抗日活动。一九四四年被捕之日，结婚尚未一年、生子尚未弥月，就视死如归。石坚和梁肃戎在日本特务机关，曾饱受各种惨刑。石坚八十岁时，其子女石宛珠、石丽珠、石掌珠、石永炎、石永垚合刊《我们的父亲》一书，书中记述石坚夫人同时被捕后，被日本特务刑求的情况：“母亲、祖父、四老爷、老姨，还有无数的同志都相继被捕入狱。当然母亲受到严刑的拷打，诸如跪玻璃碴儿、十指穿针、香烟烧乳头，至于皮鞭的抽打就不在话下啦！可是母亲由于平时父亲告诉她，如果说出来一个，就永无止境的要一一供出更多的人，也就是要受更多的刑。所以母亲一口咬定什么都不知道。”又记述说：“这期间妈入狱了，我们搬回南关和爷奶一起住，爷爷就代替了妈和爸的工作，给我们烧饭，照顾我们，当空袭时爷爷会把我抱进地窖里（地下室），爷爷有多累、多焦心。儿子、媳妇双双被捕，当时我无法了解，后来空袭越来越频繁了，老姑便送我们三个小孩儿回乡下老家去，在那段时间二哥才十二岁，便成了小保母，兄妹三人相依为命，后来不久又接我们回沈阳去，因为奶奶死了，这时妈已从狱中出来，她的头发全都掉光了，骨瘦如柴真的完全变了形。”当时东北志士为救国抗日所付的代价，自非今日暖房中成长夺权的国民党所能想像。
当时除石坚夫人饱受酷刑外，石坚手下梁肃戎亦祸延乃妻，梁夫人被日本特务当场轮奸给梁肃戎看。此事东北老辈同乡一直代为掩饰，不过实无必要，因为掩饰适足以减轻日本军阀之丑恶，这是不对的。",真正的代价常在没有好处时支付,李敖写梁肃戎在敌人统治下加入地下工作，犯法、玩命、前途有限，却仍去做。人生中辨认真勇气，要看行动发生在有利可图时，还是发生在风险最大、掌声最少时；没有好处仍承担代价，才最能说明信念。,勇气;代价;信念
QWQS102,《千秋万岁乌鸦求是合集》,132.马英九的乳臭之言.txt,马英九的乳臭之言,"这一段答话，告诉了我们，马英九所谓的直接接触、眼看、问候、握手都不算，拥抱也不算，而是精神上的此身清白。李敖多年前有名言说国民党是“意淫大陆，手淫台湾”，如今照马英九的论调，则更进一步，何须“意淫大陆”，自己部长、总裁亲临了大陆即可。但被人看了、握了，甚至拥抱了，都没关系，我们仍旧“目中有色，心中无色”！俄国文学家库普林（Alexander Kuprin）写（Yama）《亚玛》一书，其中妓女玛格达琳（Magdalene）整天接客“三通”，而自言自己是处女，马英九认为郭婉容虽去大陆仍能守身，岂不正是小说人物？这种幼稚的饰词，岂不太可笑了吗？
立委陈水扁又问他：“通信、通商、通邮、通航、通货，全都通了，而要通就要接触，现在我们已有很多民间团体到大陆去，而半官方的团体也已前往，请问我们的法官去了没有？”他答：“法官是以个人身分前往的。”问他：“这是你个人的想法。”他答：“我们如到大陆地区参加国际性会议，其会后所有的活动均可参加。”问他：‘游开亨先生去大陆时，是否说过以中华民国的法官身分前往？有无说是以个人身分前往？其头衔有无加上中华民国最高法院的法官和庭长？”他答：“我们的认定是，凡公务人员到大陆参加国际活动，均是以个人身分前往。”他问：“这是鸵鸟作风。你自己认为是民间、是个人，但中国大陆却认为是官方的代表；郭部长婉容、游庭长开亨都是官方的代表呀！难道法院不是官方的？”他答：“到大陆去的人并不是每个时间都属官方的，如散会后到小馆吃饭，这时并不代表最高法院，对不对？所以仍有民间与官方身分的分别。今天，游庭长开亨等多位法官均具专门知识，他们是到大陆参加专业知识的会议，如此而已。”
这一段答话告诉了我们，马英九所谓的公务人员身分，原来是随时变的，“并不是每个时间都属官方的！”他并举出吃饭时间就不是。这可真是天下怪论！如果这怪论成立，那么马英九只有上班时间是公务员马英九，下班时间便不是了；到立法院会议室中是公务员马英九，到立法院洗手间掏出小鸡鸡小便时便不是了。人的身分可以这样被割裂吗？可以在一饭之间、一尿之间就变更身分吗？心理学上有“人格分裂”之说，但从未闻政治学上有这样的“人身分裂”之说？德国政治家斯特来斯曼（Gustav Stresemann）声言夜里九点钟前他是外交官，九点钟后是“歌德专家”，要专门做歌德研究，其言虽诡异，亦未在学术研究时否定他是公务员，马英九却缺“德”如此，这种幼稚的饰词，岂不太可笑了吗？",身份不能按方便随时切换,李敖批评公务人员到大陆开会却自称个人身份，讽刺身份不能吃饭时有、开会时无。人生中承担一种角色，就不能只在有利时承认、不利时切割；身份背后有责任，方便主义会把人格切成碎片。,身份;责任;诚实
QWQS103,《千秋万岁乌鸦求是合集》,135.强盗的让步.txt,强盗的让步,"六月二十九日官方新生报一版头条标题说：“朝野协商选罢法修正案，执政党顾及政治和谐做出重大让步，内乱犯将可参选公职人员。”内文说：“针对‘选罢法修正案”朝野的重大歧见，立法院朝野两党昨（二十八）日举行协商，执政党做了最大的让步，全面开放‘内乱犯’得以参选省、县市长及民意代表。执政党立委党部书记长饶颖奇对此次朝野协商表示，执政党鉴于‘动员戡乱时期终止’政治情势改变，且为扶植民进党做为一个健康的反对党；同时民进党亦做了相当大的让步，表示绝不重演激烈的肢体抗争，所以为换取立法院的形象，执政党同意做此让步，全面开放‘内乱犯’参选之权利。”
看了这种标题和内文，真令人气愤。按《动员戡乱时期公职人员选举罢免法》第三十四条：“曾犯内乱、外患罪，经判决确定者”，“不得登记为候选人”。但这一条，显然公开与《中华民国宪法》第十七条人民有参政权抵触，根本是违宪的。国民党伪政府把自己订的宪法都不遵守，悍然抢去人民的参政权，这种行径，与强盗何异？
如今，在时势改变后，国民党伪政权“做出重大让步”，开放政治犯竞选了。这种让步，其实算不上什么让步，只是把被强盗抢去的权利还归原主而已。强盗把抢去的吐出来，还说了一大堆冠冕堂皇的理由，真恶心人呀！",还给别人权利不能叫施舍,李敖批评开放“内乱犯”参选被说成执政党让步，指出参政权本属人民。人生中把抢来的东西还一部分，不能装成慷慨；真正的公平，是承认那本来就不该被剥夺，而不是感谢剥夺者终于松手。,权利;公平;施舍
QWQS104,《千秋万岁乌鸦求是合集》,138.如此春蚕，如此吐丝.txt,如此春蚕，如此吐丝,徐君这篇发难的文字，载在1964年3月出版的《中华杂志》。当我一看见这篇作品的时候，立刻意识到这是一个学术思想其名而政治其实的事件，于是决心置之不理。……因此，我保持沉默。在这一期间，这儿有所谓“文化论战”。在论战中，胡秋原君知识上的短缺，思想上的混乱，被我的一群学生指破。尤其是他参加“闽变”的往事，被李敖君指出。这一下使他的名流声威扫地。他痛心疾首之余，认为系我在背后策动，于是在《中华杂志》上参加徐君对我的围攻。这二位先生的言论，充满对我的污蔑、毒骂及构陷，但却俨然为学术尊严及自由民主和反共爱国而仗义执言。标榜历史文化儒家道德的某君，则从旁助威。对于这一切，我依然保持沉默。岂知我愈是沉默，他们愈是生气，愈是提高毒骂的阶梯。这一阵狂流，滋生出一些出版物，纷纷以构陷殷海光为赚钱并耸动听闻的法门。……这些出版物的基调几乎完全来自胡、徐二君……（一）殷海光是反民族、反传统的毒素思想的泉源。（二）殷系一伪自由主义者，实际上是一政治煽动者和投机政客。（三）殷系一文字卖国者。（四）殷系一知识诈欺者。（五）殷系从事煽动颠覆。（六）费正清（J. K. Fairbank）勾结毛泽东，殷海光勾结费正清。结论不言而喻了。,沉默有时是识破政治陷阱,殷海光面对以学术为名、政治为实的围攻，先选择沉默，因为他看见那不是正常论辩。人生中并非所有攻击都值得回应；若对方要的是把你拖进污泥，沉默不是怯弱，而是拒绝按陷阱设定的方式出场。,沉默;陷阱;判断
QWQS105,《千秋万岁乌鸦求是合集》,138.如此春蚕，如此吐丝.txt,如此春蚕，如此吐丝,八月十二日上午八时半，突有人敲门，我去开门，看见一陌生人，年岁在五十左右，手中拿着封信，说某总部某处长请殷先生，状颇紧急。他说的时候，将信在空中晃了一下。我一看那信确实是给我的。但他又说：“这封信必须带回去。”我当时没有悟过来，为什么写给我的信又须带回去。事后我才恍然大悟，原来是怕留证据在我手里，证明他们作了黑事。我对那个来人说：“哦！好！让我去穿衣。”穿好衣，我随他出门。内人一点也不知道。我看见巷口又有一人，旁停一大黑汽车，车内有一司机。我觉得这种形势不妙，但只得跟着他们上车。约十分钟后，车开进一铁刺网并有持枪刺士兵守卫的大门内才下车。下车时我瞥见院内观者颇众。因为这里是关重政治犯的机关。我被导入一间屋子，坐了一会儿，主事官员三人出现，七扯八拉的盘问了许多话。之后，其中一人说：“现在，我们言归正传，教育部来一聘书，请你到那边去任职。”他一边说一边把聘书放在我面前。我看见这种光景，大为骇异。心里想：“怎么教育部文机关的堂堂聘书要在对付政治犯的武机关来发？”当时的气氛和暗示，显然是告诉我，如果不接受这张聘书，便休想回家。可是，我的义愤使我产生了勇气。我对那张聘书正眼也不看一下，我正色告诉那些官员说：“今天的事，我纵然不公开说出，难保不被外间知道。我这个人，一举一动，都是有人注意的。现在大陆上正在整肃知识分子。如果今天的事被外面知道了，说台湾学大陆，也整肃起知识分子来，从殷海光开刀，这对大家都是不利的。”接着我又说：“……我并非对在台湾大学教书有那么高的兴趣。我老早想离开这里，到别处谋生，只是一时不得其便罢了。……我看今年在台湾大学拖过去算了，大家脸面好看些。”那几位官员似被说服，由一位高级安全人员送我回家。礼貌还算不错。,黑手最怕留下白纸证据,殷海光被带去接受“聘书”时，对方连给他的信都要带回，怕留下黑事证据。人生中越是不正当的权力，越害怕痕迹；遇到含糊命令、口头压力和不留文件的安排，更要警觉它背后可能正是不敢见光的部分。,证据;权力;警觉
QWQS106,《千秋万岁乌鸦求是合集》,139.有恩于林正杰的下场.txt,有恩于林正杰的下场,"给林正杰这种蒋派作风举证的，不假外求，就在林正杰自己的白纸黑字上。一九八三年，林正杰写《怎样利用李敖》，曾这样大捧特捧“李大哥”：“很多人都说，党外新生代在利用李敖做‘超级打手’。不错！在《进步》杂志的时候，我们一个月利用李敖一次；到《深耕》半月刊的时候，我们一个月利用李敖两次；到《前进》周刊的时候，‘李敖租界’更高密度地利用李敖，一个月四次；到《民主人》开辟‘李敖特区’之后，我们一个月利用李敖六次。利用李敖只有两种方式，第一种如远流出版社的王荣文。王荣文请李敖编《中国历史演义全集》，开价□□万，编《中国名著精华全集》，开价□□万。这是李敖的编辑行情，这种行情，只有大出版家有此气魄。另一种利用李敖的方式，完全免费，但要诉诸李敖的侠骨豪情。党外新生代所办刊物，与李敖会师之后，联手打击魔鬼，修理传统，制裁恶势力，李敖所写的五十多篇文章，从来没有收过一毛钱的稿费。李敖所写的文章，只打老虎、不拍苍蝇。……除此之外，李敖还兼‘党外纪律委员会’主任委员，又兼‘反对派血统鉴定师’、‘反对理论建筑师’。这些炮口朝内的文章，李敖言者有心，只怕听者无意。在发育中的党外，如果要避免成为类似当前官场的小格局政客，对李敖的文章应多参考，少生气。”
看了这些大捧特捧的话，谁能想到，同一个林正杰，在两个月后，在同样的白纸黑字上，却对恩人恶言相向了。两个月前，白纸黑字还夸奖我“炮口朝内”呢！两个月后，却责备我“刀口向内”了；两个月前，还歌颂我“与党外新生代所办刊物，……联手打击魔鬼”呢！两个月后，却挖苦我不“互相扶持、同舟共济”了；两个月前，还呼吁“发育中的党外”要“应多参考”李敖的文章，“避免成为类似当前官场的小格局政客”呢！两个月后，居然“小眼睛”“不识大体”的，不是“政客”而是李敖了；两个月前，还赞美我“侠骨豪情”呢！两个月后，居然“李大哥”什么都不是了。……这种种高速的言行不一、反复无常，岂不太滑稽了吗？
其实，这还算是客气的呢！两个月后之后，林正杰索性联合起国民党特务，干脆用造谣诽谤的法子，甚至用捏造法院判决书、捏造文献会图片等法子，用来斗臭恩人了。一九八六年五月二日，蔡仁坚写信给我，坦承“李大哥：……您有恩于前进”，但是“有恩”的下场，就是动员《前进》杂志一连四个月三十个星期的对恩人展开造谣诽谤！这种是非品质与道德品质、这种高速的忘恩负义与过河拆桥，我纵观古今中外，真还没有见过。我写过《蒋介石研究》一到五集批评过蒋介石，但蒋介石在格局上与速度上，也不足以下比林正杰。张春男说林正杰像蒋介石，蒋介石死而有知，当大喊“娘希匹”于地下。林正杰这种小政客，他的无情无义是别树一帜的、后来居上的、超越前进的，蒋介石太落伍啦！",看人要看他如何对待恩人,李敖列举林正杰前后白纸黑字，从大捧到造谣，显示忘恩负义的速度。人生中判断一个人的品格，不只看他如何对敌人，也要看他如何对曾帮助过自己的人；利益一变就翻脸的人，再会讲理想也靠不住。,识人;感恩;品格
QWQS107,《千秋万岁乌鸦求是合集》,144.给段宏俊上一课.txt,给段宏俊上一课,"我在六月二十二日写《李庆华与生殖器政治》，指出：从正常的民主社会看，李庆华所谓的“参选是一个公民应享的权利。干涉别人的参选与否，是不民主的行为”，这话没错。但是，李庆华他老子刚由中央党部秘书长转任行政院长，又兼中央辅选小组召集人，纵李焕本人一本至公大义灭亲，明说不帮他儿子，但从龙附凤之徒，又岂能就此赴义而把李焕的至亲灭掉？所以，李庆华出来参选，是形式上十足“民主的行为”，实质上却十足是“封建的余荫”，在国民党的封建结构没清除前，他的参选，是不识大体的。另一方面，蒋介石君临海峡两岸四十七年、蒋经国御驾台湾小岛十三年，合计六十年于兹，可是人才寥落，行政院长除李焕外，竟不做第二人想；立法委员不过数名，李庆华还要分“狮子的一份”（the lion's share），岂不示天下以不广哉？所以，李庆华出来参选，是国民党人才寥落、示天下以不广的最好证明，在国民党的人才政策没开放前，他的参选，是不识大体的。因此我提出“政治回避法”，主张李庆华应该“回避”。
七月三日，老友段宏俊发表《为李焕父子说几句公道话》，反驳我的论点。他说：“如果说李焕、李庆华的父子关系，要有什么‘避嫌’或‘回避’，只有一种将来的情况可以考虑：李庆华选上立法委员之后，行政院长李焕先生到立法院接受总质询时，尽量避免父子直接接触。然而，这个考虑绝对不能构成任何理由，阻止李庆华参选立法委员；宪法规定中华民国公民人人有参政权。今年年底选举，已有几位杰出演艺人员出马竞选立法委员，如果以‘避嫌’、‘回避’的传统封建观念来看，演艺人员在古代是‘优伶’，更无参政权的。今天我们的民主政治，能够进步到演艺人员有可能进入国会（按：日本民主政治比我们进步，所以影星李香兰二十年前就当上国会议员了），这种全民民主精神的显现之下，还要谈‘父子回避’，未免迂腐到南宋时代去了！”“攻击李焕父子的人，不妨把眼睛放亮一些多见识一些世面、把耳朵清洗一下多听一些世界消息，不要再闭门造车自以为是，落得井底蛙供人一场笑话！”“古人有明训‘内举不避亲’，先总统蒋公介石曾任蒋经国先生为行政院长，为世界政治史上少有的‘父子档’而传为美谈，为台湾三十年建设打下安定基础。今天李换院长并未拔擢儿子李庆华当部长或省主席，李庆华自己去找老百姓选他的立法委员，一个是政府治权范围，一个是民意参政权范围，互不隶属，何‘避’之有？”",形式民主也可能藏着封建余荫,李敖谈政治人物子弟参选，指出表面是个人权利，实质可能借父辈权势分走机会。人生中判断公平，不能只看程序上有没有资格，还要看资源、关系和压力如何分布；形式自由若被权势加持，结果仍可能不公平。,民主;特权;公平
QWQS108,《千秋万岁乌鸦求是合集》,146.我的待客之道.txt,我的待客之道,"关于怕自己的时间过于浪费在朋友身上方面，这一怕，随着年华老去、来日无多，更形严重。有些人整天游手好闲、喜欢跟你聊天，我最怕交到这种朋友，因为实在没工夫陪他神聊，但这种人往往又极热情、极够朋友，你不分些时间给他，他将大受打击。所以一交上这种朋友，就不能等闲视之。这种朋友会出现在你面前，以怜悯姿态劝你少一点工作，多享受一点人生。当然我是不受劝的，我照样过我的清教徒生活，不烟、不酒、不茶、不咖啡、不下棋、不打牌、不考究饮食、不去风月场所，什么三温暖、什么啤酒屋、什么电影院、什么高尔夫球……统统与我无缘。这种朋友看我如此自找苦吃，也就懒得再劝我，只是间歇性的跟我吃碗牛肉面、或买来便当到我书桌旁同吃、或同我快步散步一段路，就逃掉了。
在这种极热情、极够朋友的人以外，有些朋友跟我颇多“君子之交淡如水”的味道。但“君子之交”还是要见面的。不过这种见面，十九都是到我家，而不是我去他家。我最不习惯去别人家作客，“君子之交”的朋友要看我，大多要来我家作客，不过，天知道那是什么客！
到我家作客的朋友，都知道我有一个奇怪的“待客之道”，就是绝不专心待客，而是要一边做工一边同客人谈话。所谓做工，大多是整理资料：圈呀、剪呀、贴呀、分呀、捆呀、搬呀……两手动个不停，也忙个不停。不过我这样做，丝毫不影响我的注意力、反应和应对。我常常给客人“教育”与“洗脑”，提醒他们我有一心两用甚至多用的本领。我告诉客人，17世纪大学者王船山可以一边向学生讲课，一边跟太太吵架，而《三国演义》中的庞统庞士元，更是十项全能。",朋友再热情也不能吞掉你的时间,李敖说最怕交到游手好闲又热情的朋友，因为年华老去，时间更不能浪费在神聊上。人生中真正的朋友应理解你的使命，而不是用热情不断索取注意力；守住时间边界，不是薄情，是对自己该做之事负责。,时间;朋友;边界
QWQS109,《千秋万岁乌鸦求是合集》,147.闭门造制度.txt,闭门造制度,"为什么国民党制度这么混乱？究其原因，国民党的总理，可谓始作俑者。国民党的总理，在推翻帝制上，开云见日，颇有功劳；但在建立民国上，却闭门造车，实贻祸患。祸患之尤者，是他一厢情愿的大造制度。殊不知制度是要经过考验、经过成长的，闭门造出来的制度，却是窒碍难行的。例如孙中山造出了《五权宪法》，他的徒子徒孙制定宪法时，劈头就说“依据孙中山先生创立中华民国之遗教”，“制定本宪法”，但是搬出“本宪法”与遗教一对照，便发现抵触丛生。乍看起来，定章分节，全是遗教的外壳，从第三章国民大会，到第十一章地方制度，无一不《五权宪法》也；但实际上，从第三章国民大会起，就大干一票，只师遗教之词、而不师其意了。估计之下，整个一部宪法，其与孙中山遗教不合者，约占百分之八十以上！这不是挂羊头卖狗肉的笑话吗？
为什么要挂羊头卖狗肉？因为事实上不得不然。但是完全抛弃羊头，国民党又做不到，于是只好羊头狗肉一齐来，把五权理论与议会政治合而为一，结果在理论上，这种合而为一就站不住。合而为一的起源是政治协商会议，在设计宪法时就要把它弄成一部民主议会政治的宪法，但它必须迁就《五权宪法》的躯壳与名目，于是弄出个四不像。固然把立法院弄成像个众议院、把监察院弄成像个参议院，无奈无法处理《五权宪法》的权能区分论。因为《五权宪法》明定五权都是治权，国民大会才是政权所在。国民大会可以修宪、可以搞出临时条款来给总统制撑腰、来给行政院伸腿、来给立法院瞠目结舌，结果呢？一旦国民大会不甘雌伏，一定天下大乱。目前制度的混乱，还算小儿科呢！
结论是，根本就该全盘西化的向民主国家移植制度，而不该闭门造制度。闭门造的制度，太多太多都是不可行的？闭门造的制度，架构上既无理可讲、法规上又乏善可陈、惯例上没有驾轻就熟的成例可依、解释上也殊少顺理成章的前事可循。闹来闹去，直到今天，一次行政院长的更迭就混乱百出，成为全世界笑料，这叫什么中华民国！",制度不能关起门来凭想象制造,李敖批评闭门造出的制度窒碍难行，必须经过现实考验和成长。人生中设计规则、流程或组织，不能只靠脑中完美图纸；制度要能被使用、被修正、被压力测试，否则越宏大越可能制造混乱。,制度;现实;设计
