id,book,source_file,source_chapter,source_text,wisdom_title,wisdom_text,theme_tags
QWQS057,《千秋万岁乌鸦求是合集》,054.论褫夺狂——兼论政治犯是终身职.txt,论褫夺狂——兼论政治犯是终身职,"滥用“褫夺公权”，除了不明现代法理和选举作业的多样性外，执法人员的无知胡来，也增加了这个问题的混乱。台湾高等法院的判决中，居然把“褫夺公权”做离奇的扩张解释，据最高法院五十年台非字五十八号判例：
“刑法第三十六条所定之褫夺公权，其被褫夺之资格，并无服兵役之资格在内。原判决以台北市政府征集被告服兵役系在被告褫夺公权期内，当时被告已无服兵役之权利及义务，其居住所迁移不报，并无妨害兵役可言，实属于法无据。”
按《刑法》第三十六条明定：“褫夺公权者，褫夺左列资格：一、为公务员之资格。二、公职候选人之资格。三、行使选举、罢免、创制、复决四权之资格。”可见二十年前，堂堂高等法院的法官，竟连刑法第三十六条都弄不清，他们不但想象事实而不去调查事实，居然变本加厉，竟想象法律条文而不去翻翻《六法全书》！以致闹出这种大笑话。最近我被这个法院的法官林晃、黄剑青，顾锦才既违事实又违法律的予以枉判，使我进一步领教了二十年来，这个法院进步又在哪儿？",想象事实和想象法律同样危险,李敖讽刺法官不调查事实，甚至不翻法律条文就想象法律。人生中最可怕的判断，是既不看事实也不看规则，却凭位置和习惯下结论；无论做管理、裁判还是评价别人，都要先查材料，再谈判断。,事实;法律;判断
QWQS058,《千秋万岁乌鸦求是合集》,055.论“快乐律”.txt,论“快乐律”,"下面的一些细节，是我从学理和经验中参悟出来的，我把它们叫做“快乐律”：
一、先平静十分钟。不管什么难题，你不是要解决它吗？先平静下来检讨，是第一步的方法。平静检讨应该是强制性的，是自己对自己呼唤。在这一点上，当然信神的人要占很大的便宜。他处在这一步，他可向他的上帝呼唤（祈祷），或向上帝的代理人呼唤（神父告解），可是不信这些的我们就苦一些，所以只好反求诸己，向自己说先平静十分钟，看看有什么法子？看看从哪里着手？问题总要解决的，自苦不是办法，还是该苦中求生。如能因自己有限度的努力，多争取一点平静或快乐，岂不更好？事情并不那么糟，从本可更糟的观点看，至少也有令人满意的几个面，努力还是值得的，大丈夫不可轻易心灰意懒，一息尚存，也要“打完这盘撞球”，来豪迈一点，振作一点，神明清爽一点，想个法子。
二、做不相干的事。所谓解决难题的法子，最好的法子是让时间自然解决——“诉诸时间”。其实人生问题根本就是时间问题，时间自然可以解决一切。用时间解决难题颇有“无为”的味道，其实“无为”（不做什么，纯任自然发展，纯任在谜中发展）也是一种有效的方法。起码的效果它可以避免“徒乱人意”。难题当前，不去想它，是一种大本领，阿基米德、歌德、胡适等都曾在国难之时潜心学问，于国难似不干己一般，他们的目的就是避免“徒乱人意”，他们显示的是镇静、从容、方寸不乱，我行我素，他们的智慧，先已认清什么是他们力所不及的事，然后，绝不为这些事伤脑筋。他们的思考训练有素，对难题限定时间去想，该想的时候想，不该想的就不想，一如船舱的分割，纵使一舱进水，对他舱并无影响。没有思考训练的人最易犯搅成一团的毛病，结果除了搅垮自己的情绪外，于事无补。",难题当前先平静十分钟,李敖谈快乐律，第一步是强制自己先平静十分钟，再检讨从哪里着手。人生中遇到难题，立刻自苦、爆炸或逃避都不是办法；先把心神收回来，承认事情还可分析、还可行动，快乐和出路才有一点缝隙。,情绪;方法;平静
QWQS059,《千秋万岁乌鸦求是合集》,055.论“快乐律”.txt,论“快乐律”,"三、苦其心志。这是意志方面的鼓励、激励、鼓舞。人总该有些意志力，意志力可动心忍性，“增益其所不能”。意志力可促使自己有一种豪迈气概，一种殉道气魄，一种“本不植高原，今日复何悔”的浩然胸怀，一种大丈夫的勇敢与从容，一种好汉硬汉的坚苦卓绝（坚忍）。苦其心志是一种男子汉的必要磨练，磨得过的人，愈坚强；磨不过的，愈狼狈。这是男子汉的升等考试，要硬碰硬才成。人不论如何软弱，也得有一些起码的信仰，要维护这些起码的，总得有一些牺牲精神，一些决绝精神。
四、劳其筋骨。工作、劳动、运动、大量的工作，大量的劳动、运动，都是转移情绪钻牛角尖的特效药。（积极可健身，消极可以生理疲劳转移）何况这些事的本身，又可带来积极的收益。“工作是把苦闷变成快乐的炼丹仙人”“A busy bee has no time for sorrow”这些都是智慧的结果，不可不采行。
五、智者的微笑（此点可含容三，苦其心志一项）智者深明人生乃悲欢离合、喜怒哀乐、生老病死、祸福相依等交综而成有浮有沉有荣有枯，得不足喜，失不足忧。故智者只是随遇而安，不徐不疾，不烦不燥，智者爱护朋友，尊重敌人，珍宝女人和小孩。智者是新约里对比文字下的人物。智者是甘地，是金格，是吕坤所描写的化身。智者修养功深，喜怒哀乐少激于外而深得于内，智者即是强者，是上通古今伟大人格的榜样。智者善于超以象外，静观万物和自己，智者坐井仍能观天，不出户仍能知天下。智者达观，智者是塞翁。智者能苦中作乐且不以俗苦为苦。智者知菜根香。智者理性不多愁善感，肠亦易断，泪不轻垂，于通人断肠垂泪之处，智者恬然若无情者，若太上忘情者。（“我但见明月，更不想什么”）智者于忧患中不失其兴致，不失其本色，不失其趣味，不失其幽默，不失其eash，不失其微笑。",智者在忧患中仍保有兴致,李敖写智者深知悲欢祸福交织，所以在忧患中不失本色、趣味、幽默和微笑。人生中成熟不是没有痛苦，而是不让痛苦垄断全部感官；能在坏日子里保存一点兴致，就等于给自己留下精神的退路。,快乐;达观;修养
QWQS060,《千秋万岁乌鸦求是合集》,055.论“快乐律”.txt,论“快乐律”,"智者看世事，一笑置之，智者有度量容人——甚至纵容人（包括朋友、敌人、女人、小孩）智者知足。智者喜看光明的一面（Lacy）智者知道“可能没那么糟”、“可能石块并不大”、“比下有余”、“设想更坏的遭遇”、“既来之则安之”。智者不惑不忧不惧。智者有耐心，知道人间事急不得。知道多一份自在即少一分苦恼，知道过一天就少一天，多努力一小时即累积（储蓄）一小时收获，快乐一天就赚了一天。智者巧于排遣，工于进修。智者可随处得智增智。智者可师任何人（老农老圃），可交任何人。智者可神交。智者虽老，然仍学牧虎关高旺所唱“我一时起了少年的心”，而知老来少，而学少年狂。
六、悟真识幻。（对未来的寄望，勇敢的梦想，也可归入此项。对未来的信念，可资鼓舞。可化去部分愁城。）人心无止境，坐这山望那山，身在福中不知福。故真者，多于未得前或已失后方悟知。美学上又有距离之说（只采最好一段，只走上坡之说），哲理上有余味之说，经济学上有边际效用之说，爱情理论上有聚则腻情必泛之说，故真者已寓幻，欢者潜生哀，得者实近失，有者翻成无。达者智者洞澈此理，故但求今日，惜余春，而不斤斤于得失去留。另一方面，达者智者多识幻即是真之说，且许多事真不如幻，非幻不可。神游也，神交也，希望也，私愿也，格于现实（时力、方便、综合趣味），非将幻作真无以得之，人生有涯，不以幻补真，何能尽享。故人不但要崇幻尚幻，还该增加一天中这方面的时间比例。（广义言之，作画、写作、看书、听唱片等皆属幻境，太太也宜千面夏娃以助幻兴。）
七、开拓眼界（换环境），关心别人（看别人），他事（找嗜好）。关心别人可忘怀自己的不幸。表现出活力，把自己生命中的一部分达不到的暂时封存吧。自私是不会快乐的，不要老是想到自己，比你不幸的人就在眼前，看：他们怎么在活着？你不是要洞澈人生吗？那你就不能把自己局限在小天地里，你就该多变化环境（如司马迁，如赫尔曼梅尔维尔Herman Melville，如海明威）。甚至“一年到三年内有所变其窠臼”，只有这样，才是文雄，否则只是蜗牛，不是勇士。并且日子久了，自己身心都会变得优柔，不复堪事。另外也属于换环境开拓眼界的一种，就是关心他事，——有兴味之事。尽量增扩兴味，大可to ride a hobby或to ride many hobbies.（以上与第二项做不相干的事互有含容）。",关心别人能把人带出自己的小牢房,李敖说关心别人、换环境、找嗜好，都能减少自困，因为自私的人不会快乐。人生中苦闷常来自把自己看得太满，所有痛苦都在小天地里回音；走出去看别人怎样活，替别人做点事，自己的困局也会变得不那么绝对。,快乐;关怀;开阔
QWQS061,《千秋万岁乌鸦求是合集》,056.讲理与讲礼.txt,讲理与讲礼,"在“礼之用，和为贵”路线上发展的民族，一切都要“以礼自防”。除非特立独行之士，谁也不敢“无礼”。晋朝阮籍的嫂子回娘家，要出发了，阮籍来送行。照中国礼法，小叔子是跟嫂子不打交道的，“叔”字的本义是“俶”字，古书里说：“叔，俶也，见嫂俶然却退也。”就是说，“叔”乃是“一见大嫂就向后转”的意思。礼法这种规定，阮籍就不以为然，他给嫂子送行，别人说闲话，他白眼一翻，骂道：“礼岂为我设邪？”（礼是给你们凡夫俗子订的，难道是为我订的吗？”）
在阮籍眼中，给嫂子送行才是真正的礼貌，才是真正的合礼合理，“礼”在合理的基础上才有意义，否则，就是无理。
在到处“讲礼”的传统中，中国民族的“讲理”训练很薄弱，最有代表性的是孟夫子。孟夫子证明“人性之善也，犹水之就下也。”他完全不想想，如果主张人性恶的人出来，也宣称“人性之恶也，犹水之就下也。”他凭什么说水只为他的理论流，不为别人的理论流。",礼要站在合理的基础上,李敖借阮籍送嫂反礼法，说明没有道理支撑的礼只是束缚。人生中尊重规矩并不等于服从一切旧规矩；当礼貌、传统或体面妨碍真实的人情和合理判断时，要敢问一句：这规矩到底为谁设、还合不合理。,礼法;理性;传统
QWQS062,《千秋万岁乌鸦求是合集》,056.讲理与讲礼.txt,讲理与讲礼,在中国式的“讲理”中，最多孟夫子这种“理不直而气壮”的角色，用这种态度讲谁对谁错，没有真理，只有无理取闹。这种人不适合讲理，而适合打架，你打我一拳，我踢你一脚，这才真叫“礼尚往来”呢！,气壮不能代替理直,李敖批评中国讲理训练薄弱，常见“理不直而气壮”的角色。人生中争论时，声音大、姿态足、情绪满，都不能自动证明你有理；真正讲理，要能经受反例、追问和逻辑检验，否则只是在用气势打架。,讲理;逻辑;争论
QWQS063,《千秋万岁乌鸦求是合集》,057.给秦孝仪先生上一课.txt,给秦孝仪先生上一课,以上所举的这些错误和笑话，无一不显示了秦孝仪先生不论谈古书还是今书，不论谈历史还是地理，不论谈中文还是英文，不论谈常识还是专题，我们都可结论他是全不及格的。我奇怪这么一位在知识上不及格的人，怎么可以主持文宣工作、主持党史会、主持学术会议？这种妙事，只有在国民党的统治下才会发生。四月五日国民党《中央日报》登秦孝仪先生的话说：“天下事，真的假不了，假的真不了！历史必须是信史，才有价值，而信史的基础在于史料的真实。……没有写作基础，只靠造假瞎编是不成的！”现在，当我们稍看一下上面的举证，就知道秦孝仪先生所做所为，都难逃“造假瞎编”之讥，这种夫子自道，这种自我画像，秦孝仪先生都一马当先，为他的党国提供了样板。看了他连续多年的丢人现眼，我真忍不住要写几句，我真要给秦孝仪先生上一课！,谈历史先把基本事实读对,李敖列举秦孝仪在史料、日期、篇名上的错误，说明主持文宣和党史不能靠地位遮丑。人生中越是要解释历史、教育别人，越不能轻慢基本事实；一个日期、一个出处、一个书名都可能暴露你究竟是在求真，还是在摆姿态。,历史;事实;读书
QWQS064,《千秋万岁乌鸦求是合集》,059.注意邓维桢谈话.txt,注意邓维桢谈话,"他们都是老狐狸。在关键的时刻，他们都很清楚应该站在哪一边。就过去的表现看，他们跟正常人没有两样，最先是为自己，其次才轮到他们的党，我怀疑人民在他们的心目中有没有地位。在人民的权力这么薄弱的时刻，争取他们至少有两个坏处：第一，人民可能被他的甜言蜜语迷惑，不做更辛苦的努力，以争取应有的权利；第二，鼓励了投机分子，使他们以为人民是可欺骗的，八面玲珑的人可以到处受到欢迎，那么真正正直、有勇气的人便被孤立，便被认为是偏激分子。
在政治游戏中，拉拢陶百川、徐复观可能有意义；但是，我们千万不能在游戏中玩昏了头，认错了人，做错了事，被别人玩弄了而自认高明。
徐复观和陶百川都是这个岛上八面玲珑的人，他们一面可以被国民党封疆大吏照顾慰问，他方面又可以被部分无知群众和党外人士歌颂瞎捧，可见他们“老狐狸”的段数之高。邓维桢说：“如果他们是可敬仰的人，我只有说，我们这个社会是既贫乏又悲哀的！”“贫乏”，因为对国民党的历史与骗局太无知了；“悲哀”，因为无知而不自知，反倒以为徐复观、陶百川是我们的朋友，反倒把笑脸的敌人当成了朋友。徐复观、陶百川这类人成为“清流”，就把真正的“清流”给挤掉了，在货币学上，这叫“劣币驱逐良币”。邓维桢说：“八面玲珑的人到处受到欢迎，那么真正正直、有勇气的人便被孤立，便被认为是偏激分子”，就是这个道理。孔夫子讨厌紫颜色，因为紫的颜色，对正宗的红颜色是一种搅局，一种似是而非。今天一些人把紫颜色当成红颜色，而认为他们跟我们一样，就全错了。徐复观、陶百川希望的国民党的上场，绝不是我们希望的国民党的下场，他们跟我们，纵使“同途”，也是“殊归”的。何况连“同途”都不是，所以邓维桢说：“我们千万不能在游戏中玩昏了头，认错了人，做错了事，被人玩弄了而自认高明。”",甜言蜜语会孤立真正勇敢的人,李敖警惕政治老手在关键时刻用温和话术迷惑人民，使更辛苦的争权努力被拖住。人生中不要被八面玲珑的人轻易收买；当投机者到处受欢迎，真正正直、有勇气的人反而会显得偏激，判断时要看谁承担代价，而不只看谁说话好听。,勇气;投机;清醒
QWQS065,《千秋万岁乌鸦求是合集》,060.论“烧冷灶”.txt,论“烧冷灶”,为了你声援义助李敖，国民党说你是美国特务，其实国民党不了解，美国特务是不会“烧冷灶”的，讲究现实的人，不懂得什么叫“烧冷灶”，“烧冷灶”这种行为，是人类中特有的一种侠骨柔情型干的。这种人，总是在别人受苦时援之以手，在别人受难时施之以同情。表面上看，这些受苦受难的人几乎没有前途、没有希望，谁都不理他，但是侠骨柔情的人，却会在这种时候予以义助——“结交在未遇之先”。晋文公在“未遇”时期、流亡到曹国时候，曹国上下，不但不礼遇他，反倒偷看他洗澡。只有大夫僖负羁有眼光“烧冷灶”，去拜访他、去送食物给他、去送钱给他。这种够朋友，绝不是讲究现实的人干出来的。,真正的义气常在别人冷时出现,李敖称赞“烧冷灶”的人格：在别人受苦、无望、无人理会时援手，而不等他发达后趋附。人生中看朋友，不要只看热闹场合谁来敬酒，要看你低谷时谁还愿意加一把火；不求回报的及时温暖，才最能照见人心。,义气;朋友;低谷
QWQS066,《千秋万岁乌鸦求是合集》,060.论“烧冷灶”.txt,论“烧冷灶”,"“烧冷灶”式的侠骨柔情，它的理论远源是中国哲学家老子那种“上人为之而无以为”的心境，这种心境，另一个哲学家韩非子给了扼要说明，韩非子说：“生于其心之所不能已，非求其为报也。”正因为心里不能不这样做，而不是做了要换取什么报酬，所以做一件事，没有现实利益的考虑，没有现实害处的顾忌，并且看不起那种考虑现实利益、顾忌现实害处的人，从而挺身而出，为因义受难的援之以手、施之以同情。这些侠义的表现，都来自“为之而无以为”的坦荡，这种坦荡使人没有现实的计较，而无条件的把人心加暖，把冷灶烧热。
多少年来，我多少次受到你“烧冷灶”的声援与义助，我从来没用文字表达过我的感觉。最近收到你的十一页长信和其他的信，我真忍不住要写下我一生中最欣赏的一种人格品质——“烧冷灶”——给你，这是我们共同追求的一个不约而同的伟大信念，在这人情冷暖的世界里，没有这些信念，世界就更失色了。",为之而无以为才见坦荡,李敖借老子和韩非解释“烧冷灶”，说真正的侠义是心里不能不这样做，并非为了报酬。人生中最干净的帮助，往往没有交换表；若每次善意都先计算利益和风险，人与人之间就只剩交易，少了让世界变暖的那一点坦荡。,坦荡;善意;侠义
QWQS067,《千秋万岁乌鸦求是合集》,061.隐而不退的告白.txt,隐而不退的告白,"从一九八二年八月二十八日起，我计划到草山（就是被国民党污染改名的阳明山）上，过“隐而不退”的生活。我专一工作，独力战斗，不见朋友们了。
也许朋友们怪我“奈何自苦如此？”“为什么自囚如此？”但我身处此岛，不管在牢里牢外，我都有孤独的身处监狱的感觉，所以也就无所谓自苦与自囚了。
《李敖千秋评论丛书》仍旧每月照出一册，每月展示我的部分工作与战斗成绩，表示我虽在高压之下，决不放弃使命。今后朋友们对我的指教和“讨教”，都请用书面给我，我也用书面回答（有的可在千秋评论上用印刷品回答）。这样书面交往，反倒容易把思考落实，容易显出具体的成果与结论。大家的生命，也不会浪费。",隐退可以是不见人但不放弃战斗,李敖说自己“隐而不退”，每月照出书，展示工作与战斗成绩。人生中退到安静处，不一定是逃避，也可能是为了更集中地完成使命；关键不在你见不见人，而在你是否仍有作品、责任和持续行动。,隐退;使命;工作
QWQS068,《千秋万岁乌鸦求是合集》,063.两个不合作主义者.txt,两个不合作主义者,阮籍与嵇康，是乱世中不同形式的两个不合作主义者，他们的祸福虽有不同、身世虽有各异，但是遭遇政治迫害则一。他们在黑暗的现状下，求生而不偷生、避死而不怕死，最后立德立言于千秋，在万古长夜中闪亮星火，最令我们怀念。,不合作有时可以用沉默完成,李敖写阮籍以绝口不谈时事避祸，同时不买名教的账，消极表达不满。人生中反抗不总是高喊，有时是在不该配合的地方不开口、不签名、不附和；沉默若有清楚边界，也是一种不合作。,不合作;沉默;边界
QWQS069,《千秋万岁乌鸦求是合集》,063.两个不合作主义者.txt,两个不合作主义者,"在他给山涛写绝交信时，曾说“阮嗣宗口不论人过，吾每师之，而未能及。”这种语气里，表现出他的反抗性，实在比阮籍高，因此他的不合作主义，也就来得积极。所以孙登便预言他“性烈而才隽”，是不会被统治者放过的。
最后，果然不出所料，嵇康终于被关在牢里。他在牢里写《幽愤诗》，说：",性烈才隽的人要知道代价,李敖写嵇康比阮籍更积极反抗，也因此更难被统治者放过。人生中才气和烈性会让人发光，也会让风险更近；若选择直撞现实，就要明白自己不是在玩姿态，而是在支付真实代价。,风骨;代价;性格
QWQS070,《千秋万岁乌鸦求是合集》,064.叉子新论.txt,叉子新论,"这个小故事，我所以一再引述，只喜欢它含意的深长。所谓“西餐叉子吃人肉”，它的思想型模，是“半调子西化”的一个类型，是选择性的接受西方现代文化，然后再“融会”固有文化，做成一个非牛非马的不伦不类的配合。其结果，外似“融会中西”，内实狗屁狗屁，并且还常搅得新旧杂揉，社会大乱。
这些“西餐叉子吃人肉”的笑剧，我们不要以为只是土人蛮子干的事，世界上许多落后的民族和国家，也都纷纷闹过这类画虎成狗的窘态，就是我们要把洋鬼子“迎头赶上”的中国人，也闹了很多。并且由于固有文化的牵制作用，我们闹出的宝相，说他举世第一也不为过。
谈到叉子，想到电影明星查尔斯劳顿演亨利第八时，镜头中的亨利第八是用手抓东西吃的。亨利第八是一四九一到一五四七年间的人，人们看了，若由此论断十六世纪的英国人吃饭还没学会用叉子，那就错了。因为牛津字典中，明明在叉子条下引用了一四六三年的有关叉子的文句，一四六三年，亨利第八还没出世呢。",半调子学习比不学更容易自欺,李敖用“西餐叉子吃人肉”讽刺选择性吸收现代文化，外表西化、内里照旧野蛮。人生中学习新东西，最怕只学工具、名词和姿势，却不改底层观念；半调子进步会给落后镀金，让人更难看见自己没变。,学习;文化;自欺
QWQS071,《千秋万岁乌鸦求是合集》,064.叉子新论.txt,叉子新论,研究人类真相，最忌不能鸟瞰全局，而去管中窥豹。所以，渊博的知识、灵活的思路，是一切求真的基础。今天以“融会中西”为号召的人，以吸收并兼有中西文化长处的人，其实只是管中窥豹的无知之徒而已。他们根本不知道文化是不能随意选择的，选择的结果就是不伦不类，就是“半调子西化”，半调子西化，绝非一半的西化，只是“西餐叉子吃人肉”的西化。,求真要有鸟瞰全局的知识,李敖说研究人类真相最忌管中窥豹，渊博知识和灵活思路是一切求真的基础。人生中判断复杂问题，不能只抓一个局部就宣布答案；看得广，想得活，才不会把偶然经验误认成世界全貌。,求真;知识;全局
