id,book,source_file,source_chapter,wisdom_title,wisdom_text,theme_tags
SXJ001,李敖书序集,001.写在居浩然《十论》的前面.txt,写在居浩然《十论》的前面,交班要看能力，不是只看血缘,把事业交给后来者，本来可以是胸襟；但交班必须等对方能承担，而不是因为亲缘或名分就提前让位。真正负责的前辈，不是恋栈，也不是放任，而是在事情上轨道、接班人有能力之后，再把位置交出去。,交班;能力;责任
SXJ002,李敖书序集,001.写在居浩然《十论》的前面.txt,写在居浩然《十论》的前面,公器不能被家务吞掉,学校、机构、事业一旦被家务和私怨拖进去，贤者就难安其位，不肖者反会喧宾夺主。公器最怕私人关系暗中支配，最后连小职员去留都不能按公理处理。真正爱一项事业，就要把家务和公事切开。,公器;家务;制度
SXJ003,李敖书序集,001.写在居浩然《十论》的前面.txt,写在居浩然《十论》的前面,为死友保存心血是人类情谊,替死去的朋友整理遗著、印行心血，不只是某种传统道德，更是人类共有的情谊。朋友已不能替自己发声，活着的人若还有能力，就该替他留下一点公道和作品。乱世中愿意做这种赔钱事，尤其显出情义的重量。,友情;遗著;情义
SXJ004,李敖书序集,002.介绍《汪政权的开场与收场》.txt,介绍《汪政权的开场与收场》,败方也要把话说清楚,成王败寇的叙事最容易把复杂人生压成一个结论。身败名裂的一方若仍有事实、幽愁和公道要说，也应被允许说个明白。人生里评价失败者，不该只听胜利者的判词；很多警世醒世的真相，正藏在败局后的自辩里。,历史;败方;公道
SXJ005,李敖书序集,003.《恶法录及其他》新版前言.txt,《恶法录及其他》新版前言,批判恶法要做成系统作业,对恶法的反抗不能只靠一时愤怒，最好能把问题一条条整理、连载、汇集，形成可供后来者查考的作业。制度性的坏，需要制度性的记录和批判。把切身之痛变成长期整理，才可能从个人委屈变成公共功德。,恶法;记录;批判
SXJ006,李敖书序集,003.《恶法录及其他》新版前言.txt,《恶法录及其他》新版前言,取舍之间，富贵要靠边站,一个人本可凭关系长保富贵，却选择进入危险的思想阵地，最后失业、书被禁，这才看得出取舍。人格不在平时口号里，而在富贵和义路同时摆在眼前时。能让富贵靠边站的人，才真正知道自己站在哪里。,取舍;富贵;人格
SXJ007,李敖书序集,004.介绍《紫禁城的黄昏》.txt,介绍《紫禁城的黄昏》,人的缺点不必抹杀证词价值,一个人可能有书呆气、旧派偏见，甚至迷恋过时礼法，但这不表示他的目击记录没有价值。判断材料时，要把作者的局限和他掌握的事实分开。成熟的读者不会因为人有毛病就丢掉证词，也不会因为证词有用就神化其人。,证词;判断;局限
SXJ008,李敖书序集,004.介绍《紫禁城的黄昏》.txt,介绍《紫禁城的黄昏》,责任要紧，危险不能取消职责,梁鼎芬在枪弹横飞时仍说“我的责任要紧”，这句话最动人处不在冒险本身，而在职责压过恐惧。人生当然要估量危险，但有些位置一旦承担，就不能一遇风险便躲到安全处。真正的责任感，会让旁人也生出勇气。,责任;勇气;危险
SXJ009,李敖书序集,004.介绍《紫禁城的黄昏》.txt,介绍《紫禁城的黄昏》,目击身经的实录最难得,历史最怕只剩二手判断和后来包装，最珍贵的是当事人“目击身经”的实录。一个时代的细节，往往只有亲历者能留下。珍惜这种记录，不是因为它永远无误，而是因为它保存了后来者无法重造的现场。,实录;亲历;历史
SXJ010,李敖书序集,005.推荐《海国男儿》.txt,推荐《海国男儿》,好书能给烦恼者以读书的喜悦,真正会写给少年和烦恼者看的书，不是拿苦难压人，而是刺激他们的兴趣，牵动他们的心，让他们到书本里寻找喜悦和安慰。教育人的文字若只讲道理而败坏兴趣，就少了功德；能把人引向阅读，本身就是帮助。,读书;兴趣;安慰
SXJ011,李敖书序集,005.推荐《海国男儿》.txt,推荐《海国男儿》,重温旧梦最好不破坏它,人生有一种快乐，是多年后重遇少年所爱的书、地方或人，而旧梦并未被现实打碎。不是每个旧梦都经得起重温，所以能重温而不破坏，尤其可贵。它提醒人，生命里有些早年的光，并不必然随年岁消失。,旧梦;记忆;快乐
SXJ012,李敖书序集,006.介绍《满宫残照记》.txt,介绍《满宫残照记》,史料要趁现场未冷时保存,满宫方圮、文物犹新的时候，有心人进入现场调查、访问、征取记录，才留下难得材料。很多历史一旦错过时机，就只剩传闻和废墟。做任何记录工作，都要懂得打铁趁热，在现场还没冷掉时把证据抓住。,史料;时机;记录
SXJ013,李敖书序集,006.介绍《满宫残照记》.txt,介绍《满宫残照记》,刻板史料里也藏着活人情,有些书看似全是刻板史料，细读却能看见家书、礼数、伪善、亲情和末世心境。读材料不能只怕枯燥，真正有耐心的人，能从断简残篇里看见活人。历史的趣味，常藏在别人嫌干的地方。,史料;细读;人情
SXJ014,李敖书序集,007.《调查局研究》序.txt,《调查局研究》序,不要把安全押在权力恩宠上,一个人今天被召见、记功、赠照，明天也可能被同一权力定成罪人。靠权力恩宠得到的安全，最不可靠，因为赏识和整肃都在别人手里。真正清醒的人，不会把生命的稳定押在上峰一时的脸色上。,权力;恩宠;风险
SXJ015,李敖书序集,007.《调查局研究》序.txt,《调查局研究》序,出狱后的见闻要写成信史,经历过黑暗而侥幸出来的人，若还能写，就该把几十年来的见闻写出来。个人受难若只停在伤口里，容易随人而灭；写成信史，才可能让后来者知道制度怎样运行、人怎样受苦、真相怎样被遮盖。,见闻;信史;受难
SXJ016,李敖书序集,007.《调查局研究》序.txt,《调查局研究》序,培养不是打倒的漂亮说法,权力最会把“培养干部”挂在嘴边，实际却用斗争和整肃毁灭干部。判断一个组织，不要听它怎样歌颂人才，要看它怎样对待有缺点、有独立性、有功劳却不顺从的人。真正的培养，是纠正和扶持，不是借机打倒。,组织;人才;权力
SXJ017,李敖书序集,008.推荐《李宗仁回忆录》.txt,推荐《李宗仁回忆录》,伟大回忆录常靠互补合作,一个亲历者有经历却未必有结构，一个历史家有方法却未必在场。好的回忆录，常要口述者和执笔者互相补足，才能把零散记忆组织成历史。人生中许多大事也是如此，懂得找互补的人，成果才可能超过个人能力。,合作;回忆录;互补
SXJ018,李敖书序集,008.推荐《李宗仁回忆录》.txt,推荐《李宗仁回忆录》,学术约定限制执笔人的手,口述者离去后，执笔者即使觉得文字不完备，也不能随意润色更改，因为学术约定和材料伦理仍在。真正严肃的整理，不是把稿子修得最好看，而是尊重资料形成时的边界。守住限制，有时比显示才华更重要。,学术伦理;口述史;边界
SXJ019,李敖书序集,008.推荐《李宗仁回忆录》.txt,推荐《李宗仁回忆录》,派系自残会毁掉共同事业,一个团体明明还有本钱，却因长期派系倾轧、自相砍杀，把共同事业打到覆巢无完卵。人生中很多失败并非外敌太强，而是内部把精力耗在争权攘利上。共同目标若敌不过小圈子私斗，失败只是早晚。,派系;内耗;共同事业
SXJ020,李敖书序集,009.我看《汪精卫传》.txt,我看《汪精卫传》,义愤不能推进科学,面对复杂人物，谴责也许必要，但过度滥用谴责语句，会让研究轻率而主观。义愤能表达态度，却不能代替分析。真正接近真相，要具体看各时期、各选择、各证据，而不是用最后结局抹平一生。,义愤;研究;复杂人物
SXJ021,李敖书序集,009.我看《汪精卫传》.txt,我看《汪精卫传》,研究先提供基料和起点,复杂问题未必能一次得出终局答案，但一部书若能提供扎实材料、年表、出处和可继续追寻的起点，就已有价值。做研究和判断，不必急着封口定案；先把可靠基料铺出来，后来者才有继续接近答案的路。,研究;材料;起点
SXJ022,李敖书序集,010.新版《军统内幕》缘起.txt,新版《军统内幕》缘起,真正改过要敢公开旧不义,忏悔不是换个立场说漂亮话，而是愿意把自己参与过的不义曝露在天下。一个人若能检讨旧主、旧事和旧我，即使被骂反复，也比守着愚忠拒绝反省更接近道义。知过能改，贵在公开承担。,忏悔;改过;道义
SXJ023,李敖书序集,010.新版《军统内幕》缘起.txt,新版《军统内幕》缘起,不要用旧眼光固定一个人,人会经过艰难曲折的变化，用四十年前的眼光去度量今天的他，可能看不见真正的转变。判断一个人，既要记得他的过去，也要看他后来有没有行动、代价和反省。把人永久钉死在旧身份里，并不等于清醒。,变化;判断;反省
SXJ024,李敖书序集,011.新印《厚黑教主传》述源.txt,新印《厚黑教主传》述源,读书要防止被群书所误,书多不等于见识多，若只是翻来覆去、东抄西抄，读得越多越可能满脑糨糊。读书最要紧的是找到有独立奇见、能打开问题的作品。真正会读书的人，不迷信数量，而警惕被没有个性的群书拖累。,读书;独立见解;判断
SXJ025,李敖书序集,011.新印《厚黑教主传》述源.txt,新印《厚黑教主传》述源,反面教材也能大破大立,有些文字看似讽世、怪诞、反面，实际是在用反话烛破权奸私隐、识破人海混沌。好的反面教材不是教人变坏，而是把坏的逻辑暴露到可笑、可怕、可醒的地步。能大破旧假象，才可能大立新判断。,反面教材;讽刺;判断
SXJ026,李敖书序集,012.新版《政海秘辛》缘起.txt,新版《政海秘辛》缘起,成事者要会礼遇智囊,李宗仁能长期不被吞掉，重要原因之一是知人善任，能礼遇真正有谋略的人。大事不是只靠主角胆量，身边能不能聚到智囊、听进策略，往往决定成败。会用人，是成事的根本功夫。,知人善任;智囊;成事
SXJ027,李敖书序集,013.《新官场现形记》序.txt,《新官场现形记》序,揭露黑暗也要有爱憎边界,痛恨败类，并不等于把所有相关的人都一起抹黑。真正有力量的揭露，既能切齿于特权分子，也能同情被剥削、被控制、不能脱身的普通人。爱憎若没有边界，就会从正义滑向泄愤。,揭露;爱憎;边界
SXJ028,李敖书序集,013.《新官场现形记》序.txt,《新官场现形记》序,小说也可以用求真态度保存历史,小说形式不妨虚构，但若写的是时代黑暗，就要尽量让见闻、朋友证词和细节互相补强。招朋引类、集思广益地处理情节，能让文学不只是发泄，而成为另一种历史证词。形式可以是小说，骨子里仍要认真。,小说;求真;历史
SXJ029,李敖书序集,014.介绍《国共斗争的见闻》.txt,介绍《国共斗争的见闻》,晚年觉悟要敢承认一生错付,垂老回首时，能说自己对某个组织有贡献、却对国家人民一无是处，不容易。真正的觉悟不是替一生涂金，而是敢承认错付和内疚。人生到最后，若还能这样清算自己，仍有重生的尊严。,觉悟;自省;晚年
SXJ030,李敖书序集,014.介绍《国共斗争的见闻》.txt,介绍《国共斗争的见闻》,恩仇俱泯后，把珍藏还给历史,一个人历经党国、漂泊和旧怨，晚年仍能把珍藏书画捐回它最该归属的地方，这是一种恩仇俱泯后的高致。真正的收藏不只是占有，更是让物回到历史脉络里，让故人翰墨重光。,收藏;历史;胸怀
SXJ031,李敖书序集,015.《鹰犬将军》新版书后.txt,《鹰犬将军》新版书后,编辑增补要敢承担责任,为一本书配图、加附录、改错字，若没有逐项给作者过目，就应明白承担不妥之责。编辑不是幕后小工，也不是随意加工者；真正负责的整理者，既要尽力让版本更完整，也要公开说明自己的责任边界。,编辑;责任;版本
SXJ032,李敖书序集,015.《鹰犬将军》新版书后.txt,《鹰犬将军》新版书后,细致校阅就是尊重事实,一个地名、一个人名、一个番号前后不一，都值得追问。认真校阅不是挑剔小错，而是在细处替历史把关。很多大真相就靠小疑点撑住，愿意逐条核对的人，才配说自己尊重事实。,校阅;事实;细节
SXJ033,李敖书序集,017.《侍卫官谈蒋介石》题记.txt,《侍卫官谈蒋介石》题记,近身材料要看距离，也要看说真话环境,侍卫、仆从等近身材料能拆开英雄包装，因为他们看见日常习气和台前形象背后的厌物时刻；但近身不等于可靠，还要问作者是否敢据实而道、是否被环境逼着一捧再捧。读人物回忆，距离和说真话条件要一起看。,材料;近身观察;据实
SXJ034,李敖书序集,018.梁漱溟和他的《忆往谈旧录》.txt,梁漱溟和他的《忆往谈旧录》,别把头衔误当思想高度,一个人被看作哲学家，不等于头脑真高明到足以称哲学家。评价人物要分清名号、角色和真实能力；有些人未必在理论上最高，却在教育、奔走国是和骨气上有价值。看人要具体，不能被头衔牵走。,识人;头衔;能力
SXJ035,李敖书序集,018.梁漱溟和他的《忆往谈旧录》.txt,梁漱溟和他的《忆往谈旧录》,经历可以成为活教科书,有些人理论未必最精深，但一生经历、见闻、选择和反省，本身就是活教科书。人生智慧不只来自抽象体系，也来自一个人怎样在时代里奔走、碰壁、坚持和回忆。读这种人，要读他的生命现场。,经历;教科书;人生
SXJ036,李敖书序集,019.汪荣祖《章太炎研究》序.txt,汪荣祖《章太炎研究》序,历史学问要配正义感,历史学者若只有考据而没有正义感，容易把活人的冤屈变成冷材料；若只有热血而没有学问，又难以服人。真正难得的是两者兼具：历史在行，同时敢为被埋没、被诬蔑的人重开公论。,历史;正义感;学问
SXJ037,李敖书序集,020.安全局机密文件——《历年办理匪案汇编》序.txt,安全局机密文件——《历年办理匪案汇编》序,机密档案也会反向作证,权力保存机密文件，原本为了控制叙事、训练机器，却可能在日后反向成为揭穿自己的证据。任何组织留下的记录，都有被重新阅读的一天。做事若只想着遮掩当下，迟早可能被自己的档案出卖。,档案;证据;权力
SXJ038,李敖书序集,020.安全局机密文件——《历年办理匪案汇编》序.txt,安全局机密文件——《历年办理匪案汇编》序,官方资料只是起点，还要逐案详追,官方汇编即使有查证作用，也常是官样文章、语焉不详，必须把个案嵌进去追问。真正的真相不在表格里自动出现，而在当事人证言、旁证、时间线和细节互相校对之后。资料可用，但不能迷信。,官方资料;个案;查证
SXJ039,李敖书序集,020.安全局机密文件——《历年办理匪案汇编》序.txt,安全局机密文件——《历年办理匪案汇编》序,秘密程序最容易护住作恶,秘密逮捕、秘密拘禁、秘密审讯若没有必要和法律根据，就会变成制造恐怖的工具。黑暗常靠不必要的秘密遮护，作恶者也靠它逃开监督。任何程序越封闭，越需要问：这是保护正义，还是保护权力？,秘密;程序;监督
SXJ040,李敖书序集,020.安全局机密文件——《历年办理匪案汇编》序.txt,安全局机密文件——《历年办理匪案汇编》序,不许上诉会制造生杀绝对权威,审判若秘密进行，又不许上诉，生杀予夺就会集中到少数人手里。即使掌权者自称为公共安全，也难保不草菅人命；若遇坏人掌权，更会演出滔天罪恶。程序救济不是麻烦，而是防止绝对权威的刹车。,上诉;司法;权威
SXJ041,李敖书序集,020.安全局机密文件——《历年办理匪案汇编》序.txt,安全局机密文件——《历年办理匪案汇编》序,保存原件也要保护提供者,公开秘密文件时，既要尽量保持原状，让读者有逼真感，也要保护提供者安全。追求真相不是鲁莽曝光一切，而是在证据价值和人的风险之间拿捏。真正负责的揭发，会记得无名英雄也需要被保护。,揭发;证据;保护
