id,book,source_file,source_chapter,wisdom_title,wisdom_text,theme_tags
BKJ001,李敖报刊集,001.李敖与“编辑室报告”.txt,李敖与“编辑室报告”,纪念一个人要抓住真精神,纪念一个人物，不能只开会、写颂文、印遗照，却没有抓住他真正可贵的精神。若吴稚晖的价值在实事求是、爽朗决绝、不做乡愿，那么所有纪念都应围绕这一点展开。对人对事都一样，仪式若离开核心，只会变成隔靴搔痒。,纪念;真精神;实事求是
BKJ002,李敖报刊集,001.李敖与“编辑室报告”.txt,李敖与“编辑室报告”,自白不能替代严谨取证,重大案件若只依赖一纸自白就把人送上断头台，疑点不澄清，社会也会蒙羞。司法的尊严不是靠官威，而是靠问案周详、取证严谨。凡牵涉人的身家性命，任何马虎都不是小错，冤狱赔不回一个活人。,司法;证据;慎刑
BKJ003,李敖报刊集,001.李敖与“编辑室报告”.txt,李敖与“编辑室报告”,权力不能只靠自律,任何一种权力，如果纯靠自律而没有外在制衡，迟早会走向滥用。司法滥权可怕，议会专横也同样可怕；不能因为一种权力来自好名义，就放弃对它设限。成熟的人看制度，永远同时看权力和约束。,权力;制衡;制度
BKJ004,李敖报刊集,001.李敖与“编辑室报告”.txt,李敖与“编辑室报告”,非法取得的证据不该定罪,保护个人秘密、通讯和居住自由，不是抽象口号，而要落实到证据规则里。若非法手段取得的材料仍可拿来定罪，权利保障就会被执法者绕开。好制度要让追求真相也守规矩，否则真相会被权力污染。,证据;权利;程序
BKJ005,李敖报刊集,001.李敖与“编辑室报告”.txt,李敖与“编辑室报告”,没有方法学，博学也会迂腐,读书万卷若缺少方法训练，所得可能只是迂；议论千篇若没有方法，所获也可能只是腐。知识界最缺的维他命常常不是资料，而是方法学。没有方法，越有学问越可能带错路，成了盲人领瞎马。,方法学;读书;思考
BKJ006,李敖报刊集,001.李敖与“编辑室报告”.txt,李敖与“编辑室报告”,自由不是任意伤人的许可证,自由本质上是一种权利，而权利总有边界。若打着自由旗号诽谤、造谣、诬告，便是曲解自由。真正懂自由的人，懂得自由与责任同在，也懂得行使自己的权利时，不能以伤害他人为主要目的。,自由;边界;责任
BKJ007,李敖报刊集,001.李敖与“编辑室报告”.txt,李敖与“编辑室报告”,抽象罪名能罗织所有书,查禁书刊若只靠“淫秽”“不洁”“危险”等抽象标签，而没有具体标准，天下任何一本书都能被罗织成罪。判断作品要有明确尺度，不能让行政偏见伪装成道德。标准越含糊，自由越危险。,出版自由;标准;审查
BKJ008,李敖报刊集,001.李敖与“编辑室报告”.txt,李敖与“编辑室报告”,坏书最好交给社会过滤,一本书是否不得当，社会批评、舆论讨论、读者选择，往往比政府禁止更合适。健康社会自有过滤作用；若让政府替所有人决定能读什么，危险大过必要。成熟的读者，需要自由选择，也需要承担选择后的判断。,出版自由;读者选择;社会批评
BKJ009,李敖报刊集,001.李敖与“编辑室报告”.txt,李敖与“编辑室报告”,自由讨论中失败也有价值,民主社会需要自由讨论和公平竞争，个人在竞争中成功或失败都不是最终重点。只要讨论推动社会接近自由，失败者也可能成为自由的功臣和证人。把个人输赢看得太重，反而会错过公共进步。,自由讨论;失败;公共进步
BKJ010,李敖报刊集,001.李敖与“编辑室报告”.txt,李敖与“编辑室报告”,机会要给能被机会镀金的人,出国考察、旅行学习、资源扶助，都可能开拓新境，但前提是对象本身有可造之材。一块铜出国可以镀金，一块木头出国仍是木头。给机会也要会选择，否则名额、公帑和期待都会被浪费。,人才;机会;选择
BKJ011,李敖报刊集,002.《文星杂志选集》导言.txt,《文星杂志选集》导言,对历史交代比眼前罪名长久,人在争取言论出版自由的路上，可能背上荒唐罪名、遭遇麻烦和迫害；但若目标是“对历史交代”，眼前的狭路就不是终局。真正能站住的人，未必马上被现实善待，却会在更长时间里接受历史检验。,历史;言论自由;承担
BKJ012,李敖报刊集,002.《文星杂志选集》导言.txt,《文星杂志选集》导言,选集也要有客观克制,主持一套选集时，有意不选自己的文章，是一种自我克制。越是与自己有关的历史，越要防止把材料变成自我宣传。真正可信的整理，不怕少表现自己，反而要让事情本身和旁证说话。,自我克制;史料;客观
BKJ013,李敖报刊集,003.《文星杂志选集》题词.txt,《文星杂志选集》题词,一时议论不如永久思想,政论性的杂志可能震动一时，思想性的工作却能留下更长久的价值。做事若只追逐当下热点，很快会被时势卷走；若能在“挖根、寻根、归根”上用力，就可能越过一时胜负，成为后来者还要回头寻找的方向。,思想;长期价值;根本
BKJ014,李敖报刊集,004.“只要寻一个不受人惑的人”.txt,“只要寻一个不受人惑的人”,最要紧是训练不受人惑,一个刊物、一本书、一个老师，真正有价值之处，不在让读者崇拜自己，而在训练读者独立思想，不受人惑。能使人从思想上脱胎换骨的工作，才算真正带路；否则热闹再大，也只是按牌理出牌。,独立思考;不受人惑;教育
BKJ015,李敖报刊集,005.被封杀的《千秋评论》.txt,被封杀的《千秋评论》,严肃判断不能靠据知,批评别人、反对别人，尤其是用严肃立场发言时，至少要先检视资料。把判断建立在“据知”这种传闻上，不是负责的知识态度。人的公允，常从承认自己资料不够、先去查证开始。,证据;判断;查证
BKJ016,李敖报刊集,005.被封杀的《千秋评论》.txt,被封杀的《千秋评论》,名称客观不保证内容客观,给刊物、组织或主张换一个“客观化”的名称，并不能自动防止个人权威、偏见或反应过度。名实问题没有那么简单，真正要紧的是内容、机制和行为。人最容易被好听名称安慰，却忘了检查实际运作。,名实;客观;判断
BKJ017,李敖报刊集,005.被封杀的《千秋评论》.txt,被封杀的《千秋评论》,道德裁判前先做自我反省,知识分子若以道德自居、高高在上裁判众生，却没有宽以待人的自省，就会把道德变成权力。容忍不是放弃判断，而是知道自己也会错、也有偏见。没有自反意识的道德感，最容易以义杀人。,道德;自省;容忍
BKJ018,李敖报刊集,007.挂“千秋”羊头，卖“万岁”狗肉.txt,挂“千秋”羊头，卖“万岁”狗肉,个人招牌可让共同事业借力,一个人的名字、声望和平台，若能帮助更多同道发声，就不必死守成私人领地。真正有格局的人，知道招牌只是工具，事业才是目的；能把个人资源开放给共同目标，影响力才不会停在自我表现。,格局;共同事业;平台
BKJ019,李敖报刊集,009.《千秋评论》停刊告白.txt,《千秋评论》停刊告白,该收束时，停刊也是前进,一件事办到创造历史之后，也可能需要停刊进入历史，把主力集中到新的战场。守住旧成果不放，未必就是坚持，也可能是在分散火力。成熟的行动者既知道何时开张，也知道何时收束，让有限精力继续服务更大的目标。,收束;集中主力;取舍
BKJ020,李敖报刊集,012.《求是报》1991年2月27日创刊.txt,《求是报》1991年2月27日创刊,被允许只是争取自由的起点,拿到执照、取得许可，并不等于真正拥有自由；它最多说明人有了争取自由的可能。人生中很多权利也是如此，别人放开一条缝，不该被误认成恩赐完成，而要看自己能否把缝隙扩大成真实空间。,自由;许可;争取
BKJ021,李敖报刊集,013.一张报，打倒你！.txt,一张报，打倒你！,小工具也能撬动大格局,一张报纸看似单薄，却可能推动民主运动、校正方向、撬动强权。工具大小不是决定因素，关键在内容、时机和志向。许多改变不是从庞大资源开始，而是从一件小而锋利的工具开始。,行动;工具;影响力
BKJ022,李敖报刊集,013.一张报，打倒你！.txt,一张报，打倒你！,打倒之后还要共同建设,“打倒你”若只停在复仇，就容易制造新的敌我循环；更高的目标，是打倒压迫后不分你我，一同建立雨后天晴的局面。真正有远景的斗争，不只是把对方推倒，而是准备好共同建设更好的秩序。,斗争;建设;远景
BKJ023,李敖报刊集,014.生公说法鬼神听.txt,生公说法鬼神听,锋芒要有分寸，艺高也不暴投,“刚中有柔，艺高胆大，绝不暴投”，说的是有锋芒也要有准头。勇敢不是乱掷火力，才气也不能替分寸背书；真正厉害的人，敢出手，也知道怎样出手，不把气势浪费成莽撞。,分寸;勇气;锋芒
BKJ024,李敖报刊集,015.《求是报》是知识贵族最便宜的报.txt,《求是报》是知识贵族最便宜的报,重质不重量，求精不求多,篇幅多不等于负责，内容杂凑只会让读者看不完、懒得看。若自己的时间和能力只能照顾一大张，就宁可重质不重量、求精不求多。做任何产品或作品，都要知道自己的照顾半径，超过半径就是不负责任。,质量;节制;责任
BKJ025,李敖报刊集,015.《求是报》是知识贵族最便宜的报.txt,《求是报》是知识贵族最便宜的报,不要拿自己的价值去跟补贴品比价,没有党派、财阀和广告支持时，不能拿自己的价格去和被补贴的廉价品硬比。真正的价值要看内容给人带来的清醒和判断，而不是只看页数和售价。若一味迁就不懂事的低价期待，反而会牺牲作品本身。,价值;定价;独立
BKJ026,李敖报刊集,016.李敖谈《李敖的报纸》.txt,李敖谈《李敖的报纸》,看现在必须温故知新,一个人的现在常从过去延续而来，只看眼前很容易被包装骗倒。历史方法和前科方法，不是为了翻旧账泄恨，而是为了看清今天从哪里来。健忘的人只看眼前，清醒的人会策往以知来。,历史方法;识人;记忆
BKJ027,李敖报刊集,016.李敖谈《李敖的报纸》.txt,李敖谈《李敖的报纸》,真理未广为人知就要重复,旧文重刊不必然是偷懒，若真理被禁、被遮蔽、尚未广为人知，就有不断重复的必要。传播不是只追求新鲜，而是让重要事实抵达更多人。真正有价值的东西，有时需要反复出现，才不被封锁吞没。,传播;真理;重复
BKJ028,李敖报刊集,016.李敖谈《李敖的报纸》.txt,李敖谈《李敖的报纸》,揭旧事要拿真凭实据说话,揭人过往旧事，若只是绘声绘影，就是恶意；若有真凭实据，并且能说明今天的性格和行为来源，就是必要的追踪。清算过去的正当性不在“旧”或“新”，而在证据是否明确、关联是否真实。,证据;揭露;历史
BKJ029,李敖报刊集,017.《求是报》停刊告白.txt,《求是报》停刊告白,能办一天算一天，也是一种尽责,明知没有财阀和广告支持，先天注定艰难，仍然姑且一试，能办一天算一天，鞠躬尽瘁、停而后已。这不是失败主义，而是把有限条件用到极限。许多事不能保证长久，但仍值得尽力做过。,尽责;现实;行动
BKJ030,李敖报刊集,017.《求是报》停刊告白.txt,《求是报》停刊告白,失败收场也要把善后做好,事业停刊、改组无望时，最能看出人的信用：余款可转订、可易书、可退款，且多抵不少付，不让订户在金钱上不快。真正的担当不只在开张时豪气，也在收场时把账交代清楚。,善后;信用;责任
BKJ031,李敖报刊集,018.《李敖求是评论杂志》发刊词.txt,《李敖求是评论杂志》发刊词,一家之言可以召集众声,“成一家之言”并不等于只剩自己一人的声音，而是召集古今中外特立独行、震聋醒聩的言论，形成光束。真正有格局的个人主张，不怕吸纳别人，反而能把分散的独立声音组织成方向。,思想;一家之言;组织
BKJ032,李敖报刊集,018.《李敖求是评论杂志》发刊词.txt,《李敖求是评论杂志》发刊词,说真话要配实事求是的论证,全说真话、专讲是非，不是靠嗓门大，而要有实事求是的论证，说明白话，主持公道。真话若没有证据和论理支撑，很容易变成情绪；有论证的明白话，才有长期穿透力。,真话;论证;公道
