id,book,source_file,source_chapter,wisdom_title,wisdom_text,theme_tags
LAXAJH001,李敖笑傲江湖,001.《李敖笑傲江湖》第一集.txt,《李敖笑傲江湖》第一集,封锁不能证明你不存在,李敖开场回顾自己被台湾媒体封杀多年，却仍靠海外报道、禁书目录和真实作品留下存在感。人生遇到封锁，不要把沉默环境误认成自我消失；只要你持续留下可检验的作品和事实，别人可以不报道你，却很难抹掉你。,封锁;存在;作品
LAXAJH002,李敖笑傲江湖,001.《李敖笑傲江湖》第一集.txt,《李敖笑傲江湖》第一集,揭发前，先完成对照,处理吕安妮事件时，李敖不是只听一边，而是见台大方面、看资料、比录音，再开记者会。人生要揭发不公，先要完成对照：当事人、对方、原件、时间线都摆出来，批判才不只是情绪的放大。,揭发;对照;证据
LAXAJH003,李敖笑傲江湖,002.悲情满朝.txt,悲情满朝,拿得起，也要放得下,李敖借叶明勋“拿得起放得下”的文章，谈人在名位、恩怨和旧关系面前的进退。人生不是只会争取才算有力，能在该退时退、该放时放，也是一种清醒；放不下的人，常被自己已经拥有过的东西拖住。,进退;放下;清醒
LAXAJH004,李敖笑傲江湖,003.劫贫济富.txt,劫贫济富,坏标准会把好标准挤走,李敖用“劣币驱逐良币”解释政策和人心如何被坏制度带坏。人生在团队、市场和社会里也一样：若纵容低标准横行，好人和好方法会慢慢退场；要保护好东西，先要阻止坏标准成为常态。,标准;制度;劣币
LAXAJH005,李敖笑傲江湖,004.私生子.txt,私生子,没有证据，就不要替传闻背书,面对读者来信传说李登辉有私生子，李敖说自己不知道，不能当成肯定说法。人生越想揭露别人，越要管住嘴；没有证据时不乱讲，不是胆小，而是让自己说出的每一句话保有信用。,证据;传闻;信用
LAXAJH006,李敖笑傲江湖,004.私生子.txt,私生子,做了事，就不要赖账,李敖批评有权势者在私生子问题上先赖账，最后被科学检验证明才承认。人生的责任不是等到证据逼上门才承担；越早承认自己做过的事，越能保住人格，拖到无可抵赖才认，只剩狼狈。,责任;人格;承认
LAXAJH007,李敖笑傲江湖,005.三毛流浪记.txt,三毛流浪记,远方的慈悲，先过近处这一关,李敖质疑三毛说要去非洲援助儿童，却忽略身边同样受苦的黄皮肤孩子。人生做慈悲，不能只挑远方、浪漫、容易被赞美的对象；近处的痛苦若看不见，远方的慈悲就可能只是自我装饰。,慈悲;近处;真实
LAXAJH008,李敖笑傲江湖,006.李敖话三国（一）.txt,李敖话三国（一）,流行叙事越好看，越要分层读,李敖谈《三国演义》有魅力，也指出它把许多历史改写成小说。人生面对动人的公共叙事，要分层读：故事可以欣赏，事实要另查；若把好看当可靠，判断就会被戏剧性牵走。,叙事;历史;分层
LAXAJH009,李敖笑傲江湖,007.李敖话三国（二）.txt,李敖话三国（二）,熟悉感不是证据,周仓、三顾茅庐等故事人人耳熟，李敖却提醒它们未必经得起史实检查。人生判断事情，不能因为从小听到大就当成真的；熟悉感常是重复造成的，证据才是事实造成的。,熟悉感;证据;辨伪
LAXAJH010,李敖笑傲江湖,008.简单的书.txt,简单的书,把简单弄玄，是知识的败相,李敖批评许多人把《易经》解释成天书，却忘了它原可从简单处入手。人生做学问或做事，都要警惕故弄玄虚；真正厉害的人能把复杂讲清楚，没本事的人才常把简单讲神秘。,简单;知识;清楚
LAXAJH011,李敖笑傲江湖,008.简单的书.txt,简单的书,一个标点，也能改掉整句命运,李敖反复强调古书断句和标点会改变意义，《易经》《论语》都可能因此呈现新解释。人生读材料、签文件、听别人转述时，不要小看细节；一个停顿、一个逗号，常能决定理解方向。,细读;标点;判断
LAXAJH012,李敖笑傲江湖,009.以德报怨.txt,以德报怨,对怨要直，不要假装高尚,李敖借“以直报怨”批评对历史仇怨的糊涂处理，认为不该用虚伪宽厚遮住是非。人生面对伤害，不必用假大度包装自己；直面事实、分清责任，比表演宽容更接近真正的公道。,公道;恩怨;直面
LAXAJH013,李敖笑傲江湖,010.中国飞弹之父——钱学森.txt,中国飞弹之父——钱学森,被羞辱时，才看清归属,钱学森在美国遭安全审查和种族羞辱，李敖由此谈民族自尊与回归选择。人生有时不是在顺境中决定自己属于哪里，而是在被轻视、被排斥时看清尊严所在；归属感常从羞辱的反面长出来。,尊严;归属;选择
LAXAJH014,李敖笑傲江湖,011.李敖与郁慕明.txt,李敖与郁慕明,坏结构会污染好名声,李敖用是否脱离国民党检验政治人物人格，重点不只在个人好坏，也在结构会不会污染人。人生看自己与什么组织绑定很重要；明知结构坏还贪恋位置，个人清名很快会被共同责任拖下水。,组织;结构;人格
LAXAJH015,李敖笑傲江湖,013.不会讲台语.txt,不会讲台语,纪念朋友，不必按俗套哭给人看,李敖说朋友死后自己不去做仪式，而是把对方的书印出来，用自己的方法纪念。人生对人有情，不必总照社会规定的样子表演；真正的纪念，是把对方值得留下的东西留下来。,纪念;友情;作品
LAXAJH016,李敖笑傲江湖,015.书呆子也谈什么教育改革.txt,书呆子也谈什么教育改革,教育改革先要有人敢顶住官僚,李敖谈蔡元培反对教育官僚，说明大学尊严不是靠口号，而靠校长和师生敢于抗衡权力。人生想改革一件事，不能只写漂亮方案；若没有人愿意承担冲突，改革很快会变成官样文章。,教育;改革;担当
LAXAJH017,李敖笑傲江湖,016.法官怕什么？.txt,法官怕什么？,独立不是写在纸上，是心里不怕,李敖指出法官虽有依法独立的名义，却常因威权阴影而心里发毛。人生做判断，最难的不只是制度允许你独立，而是你真敢独立；心里怕权力，再完美的规则也会被自己先背叛。,独立;勇气;司法
LAXAJH018,李敖笑傲江湖,017.你所不知道的陈之藩.txt,你所不知道的陈之藩,安慰不能替代治疗,李敖提到有人以宗教方式看病，胡适批评这会害人。人生面对病痛和困难，精神安慰可以陪伴人，却不能替代真正的方法；把愿望当疗法，常是用温柔的方式耽误现实。,现实;方法;安慰
LAXAJH019,李敖笑傲江湖,018.言论自由.txt,言论自由,自由不是恩赐，是争来的,李敖谈宪法写有言论、讲学、著作、出版自由，但这些自由从来不是当权者主动喜欢给的。人生要明白，写在纸上的权利需要人去使用、冲撞和守住；不争取的自由，会慢慢只剩字样。,自由;争取;权利
LAXAJH020,李敖笑傲江湖,020.笑傲江湖一周年了！.txt,笑傲江湖一周年了！,民有尊严，权力才会收敛,李敖借“藏富于民”谈财富与尊严，认为老百姓有力量，政府才会被逼着尊重人民。人生在任何关系里都一样：自己没有资源和尊严，只靠对方良心，很难换来真正尊重。,尊严;资源;权力
LAXAJH021,李敖笑傲江湖,021.扯烂污的中央日报.txt,扯烂污的中央日报,权威先要经得起自己的标准,李敖批评《中央日报》一面装作正派权威，一面自己刊出违背其道德姿态的内容。人生看任何权威，先看它能不能承受自己要求别人的标准；只会管别人、放过自己的权威，最不可靠。,权威;标准;自检
LAXAJH022,李敖笑傲江湖,022.五〇四大游行.txt,五〇四大游行,别用“不要政治化”逃避责任,李敖批评当权者面对社会事件时说不要泛政治，却回避制度和权力责任。人生遇到问题，当然不能乱扣帽子，但也不能用“别政治化”“别复杂化”来掩盖结构性责任。,责任;结构;逃避
LAXAJH023,李敖笑傲江湖,023.三种混蛋的人.txt,三种混蛋的人,用历史方法逼出原意,李敖批评不懂历史方法的人解释宪法和政治，只会绕在现成立场里。人生处理争议，要回到原文、原意、背景和当时条件；离开历史脉络的解释，常只是替立场找衣服穿。,历史方法;原意;解释
LAXAJH024,李敖笑傲江湖,024.金钱外交.txt,金钱外交,买来的面子，最容易被当众退货,李敖谈金钱外交的羞辱，指出靠钱买关系，最后仍可能被别人设期限、算成本。人生经营关系也一样，若只靠利益维系而没有真实尊重，关系表面热闹，关键时刻却会冷冷结账。,关系;尊严;利益
LAXAJH025,李敖笑傲江湖,025.两截无耻.txt,两截无耻,青春回不来，历史不能灰,李敖谈于右任诗，认为青春不可换回，但历史不容尽成尘灰。人生有些失去无法追回，可是事实仍可抢救；不能把时间倒回，就把真相留下，这也是对过去最有力的补偿。,历史;真相;补偿
LAXAJH026,李敖笑傲江湖,026.国民党的言论自由.txt,国民党的言论自由,反驳坏话，不该靠封嘴,李敖说股票节目即使有人胡说八道，也不应由行政命令禁止传播。人生面对错误言论，最好的办法不是先封住对方，而是拿出更好的证据和判断；靠封嘴赢来的安静，不是真理胜利。,言论自由;反驳;证据
LAXAJH027,李敖笑傲江湖,027.病态的教科书.txt,病态的教科书,教科书里的用词，会塑造人的历史眼,李敖批评教科书用“清领”“日据”等词背后藏着历史立场和政治操作。人生读公共文本，不要只看它讲了什么，也要看它怎样命名；词语一旦被制度化，人的判断就会被悄悄牵走。,语言;教科书;历史观
LAXAJH028,李敖笑傲江湖,028.无知的中国人.txt,无知的中国人,知识不足的豪气，常是笑话,李敖批评有人用贫乏的世界史和地理知识支撑政治口号，听来热血，实则荒谬。人生表达立场前，先补足知识；没有知识的勇敢，常只是把无知喊得很大声。,知识;立场;无知
LAXAJH029,李敖笑傲江湖,029.官僚体系没有脖子.txt,官僚体系没有脖子,专业位置，要让专业人坐,李敖比较军阀时代某些任用还讲专业，批评国民党任人唯亲、乱塞位置。人生管理任何组织，都不能把财政、外交、教育当成酬庸座位；专业位置错配，最后受害的是整个系统。,专业;组织;任用
LAXAJH030,李敖笑傲江湖,030.监察院只打苍蝇.txt,监察院只打苍蝇,问责只打小人物，就是假问责,李敖批评监察机构弹劾对象越来越低，只处理小官小事，不碰真正有权者。人生看一个制度是否认真，不看它有没有动作，而看它敢不敢追到高处；只打苍蝇，常是替老虎遮丑。,问责;制度;权力
LAXAJH031,李敖笑傲江湖,031.国民党手淫台湾、意淫大陆.txt,国民党手淫台湾、意淫大陆,主轴一直换，说明心里没轴,李敖统计民进党竞选主轴多次变化，用来说明政治口号缺乏稳定判断。人生做事也一样，策略可以调整，但核心判断不能天天换；主轴飘来飘去，常说明心里根本没有轴。,判断;策略;稳定
LAXAJH032,李敖笑傲江湖,032.刁民说.txt,刁民说,坏政府面前，刁一点是公民责任,李敖自称愿做坏政府、黑暗法院和歪曲历史机构眼中的刁民，因为他会拿证据作对。人生不必在所有权力面前都做乖人；当权力坏、事实被改，敢刁、会查、能追问，反而是责任。,公民;追问;证据
LAXAJH033,李敖笑傲江湖,034.国民党到底几岁.txt,国民党到底几岁,连年龄都要作假，别信它的大叙事,李敖追查国民党建党年龄，指出组织为了宣传会把起源和资历拉长。人生看个人或机构包装历史，先查最基本的数字；若连年龄、来历都要美化，它讲的大道理更要打折。,来历;数字;宣传
LAXAJH034,李敖笑傲江湖,035.调查调查局.txt,调查调查局,查黑暗，不要只骂黑,李敖说调查调查局不能只喊黑暗，而要拿证据、事实和案例把问题钉住。人生揭发任何系统，愤怒只是起点；事实越具体，黑暗越难躲，批判也越不容易被说成空骂。,调查;事实;批判
LAXAJH035,李敖笑傲江湖,036.我是第六伦.txt,我是第六伦,解释权不是职位给的，是本事挣的,李敖反对把“第六伦”的解释权交给国民党大员，认为没资格的人不该垄断解释。人生在知识和价值问题上，不要迷信头衔；真正的解释权来自材料、识见和说服力。,解释权;头衔;本事
LAXAJH036,李敖笑傲江湖,037.不合作运动.txt,不合作运动,批评失效时，用退出划边界,李敖借蔡元培和五四时代谈不合作：黑暗官僚若让你骂却照做坏事，光骂就不够。人生面对顽固系统，批评之外还要保留退出、拒绝配合的能力；不合作是在划出最后边界。,不合作;退出;边界
LAXAJH037,李敖笑傲江湖,038.言论的迫害.txt,言论的迫害,迫害常分两步走,李敖谈国民党查禁刊物：先停刊一年把人打昏，再不准复刊彻底杀死。人生识别打压，不要只看第一下是否温和；很多伤害会分阶段推进，等你以为缓一缓，它已经把路封死。,迫害;警觉;自由
LAXAJH038,李敖笑傲江湖,040.宝里宝气的岛.txt,宝里宝气的岛,小动作里常藏着大关系,李敖从照片站位和细节读出蒋家人物之间的身份、分寸与心态。人生观察人际关系，不只听公开说法，也要看小动作、小位置、小避让；真正的关系，常在细枝末节里露出来。,观察;关系;细节
LAXAJH039,李敖笑傲江湖,041.李登辉的真面目.txt,李登辉的真面目,记忆会骗人，档案不容易放过人,李敖用旧文章和材料指出彭明敏关于“光复”一词的说法站不住。人生遇到名人自述，不要只听当下记忆和姿态；旧档案、旧文字、旧记录，常比人的现时说法更诚实。,档案;记忆;核实
LAXAJH040,李敖笑傲江湖,042.无诚信的李登辉.txt,无诚信的李登辉,群众不要求诚信，坏领袖就会坐大,李敖批评政治人物食言，更批评群众不在诚信上要求他。人生在任何共同体里，坏人可怕，纵容坏标准的人也可怕；若大家不把诚信当底线，谎话就会变成政治能力。,诚信;底线;群众
LAXAJH041,李敖笑傲江湖,043.台湾的卢泰愚.txt,台湾的卢泰愚,财产越会消失，越要追它怎么转身,李敖分析权贵财产如何通过家人和死者名义偷天换日，提醒人看权力背后的财物流向。人生判断一个人的清白，不只听他说什么，也要看钱怎样移动；钱的转身处，常是真相入口。,财产;真相;追踪
LAXAJH042,李敖笑傲江湖,045.李登辉钳制言论自由.txt,李登辉钳制言论自由,自由的毛病，要用更多自由治,李敖引用史密斯的话，说明民主和言论自由的缺点，不能靠压制来解决，而要靠更多自由。人生面对开放带来的混乱，不要急着退回控制；用更公开的讨论、更充分的竞争，才可能把错误洗出来。,自由;开放;纠错
LAXAJH043,李敖笑傲江湖,046.蒋纬国的“房事”问题.txt,蒋纬国的“房事”问题,正义若只打落水狗，就不是真正义,李敖质问陈水扁只拆某些人的违建，却不碰自己人和更大权贵。人生看正义，要看它是否一体适用；只敢打弱了的敌人、不敢照自己，正义就会变成选择性表演。,正义;标准;一致
LAXAJH044,李敖笑傲江湖,048.李登辉是民主先生？.txt,李登辉是民主先生？,民主若没有法治，只是空壳,李敖说民主只是过渡，真正目的在法治；没有法治，民主会被人利用成漂亮口号。人生看制度、团队和关系，也不要只听参与、投票、开放这些词；没有规则约束，热闹常只是空壳。,民主;法治;规则
LAXAJH045,李敖笑傲江湖,050.李登辉胡说八道.txt,李登辉胡说八道,要谈四百年，就别只挑好看的四百年,李敖指出若从台湾四百年历史谈起，就必须谈汉人压迫原住民的历史，不能只取有利叙事。人生回看过去，不能只挑能抬高自己的部分；敢把不光彩的来源也讲出来，才算诚实。,历史;诚实;选择性
LAXAJH046,李敖笑傲江湖,054.李登辉是自大狂.txt,李登辉是自大狂,自己修出的规则，也要自己守,李敖批评权力者不断修宪，却连自己修出来的体制边界也不遵守。人生制定规则时最容易显得高明，真正难的是轮到自己受约束时也照做；不守自己规则的人，没有资格谈制度。,规则;制度;自律
LAXAJH047,李敖笑傲江湖,056.台湾选举的笑料.txt,台湾选举的笑料,最后解释的人，未必输给抢先解释的人,李敖说自己解释李师科事件不是最早，却可能比别人解释得更好，因为不急于抢话。人生面对复杂事件，不必急着第一个表态；等证据多一点、脉络清一点，迟来的判断反而更稳。,判断;耐心;解释
LAXAJH048,李敖笑傲江湖,057.曲线政治学.txt,曲线政治学,明白文字，不要硬拗成曲线,李敖批评有人把法律明文说成仍需曲线解释，回避文字本身的清楚意思。人生遇到规则和承诺，先尊重明白文字；需要硬拗才成立的解释，往往是在替私心找出口。,文字;规则;解释
LAXAJH049,李敖笑傲江湖,060.恩仇可泯乎？.txt,恩仇可泯乎？,涉及读书，错误就要细算,李敖面对读者指正诗句问题，逐层说明律诗结构和用语，显示读书上的错误不能含混。人生在学问和事实问题上，厚道不能替代准确；越是细节，越能看出一个人是否认真。,读书;准确;细节
LAXAJH050,李敖笑傲江湖,061.你不知道的司法黑暗（一）.txt,你不知道的司法黑暗（一）,追司法正义，要能忍受寂寞,李敖说追求司法正义的过程艰苦又寂寞，有些真相并不能立刻被法律承认。人生要替不公争到底，不能只靠一时愤怒；能够长期查、长期写、长期逼问，才有机会把黑暗逼到台前。,司法;正义;坚持
LAXAJH051,李敖笑傲江湖,062.你不知道的司法黑暗（二）.txt,你不知道的司法黑暗（二）,把受难整理成书，痛苦才不会白费,李敖把司法黑暗材料写成厚书，甚至用出书来为自己祝寿。人生遭遇不公，若只留下怨气，很快会散；把证据、经历和思考整理成作品，痛苦才会变成能继续发力的东西。,作品;苦难;整理
LAXAJH052,李敖笑傲江湖,064.揭穿假政治犯“柏杨”.txt,揭穿假政治犯“柏杨”,赞美的词，也有使用边界,李敖抓住“孺慕”等词的误用，批评文章里为权力写出的肉麻姿态。人生写作说话，不能只求漂亮和感人；每个词都有边界，用错了词，常会暴露立场的谄媚和脑子的粗糙。,语言;边界;写作
LAXAJH053,李敖笑傲江湖,065.李敖的三个主义.txt,李敖的三个主义,支持事情，不投靠阵营,李敖说自己不投靠各党，只在事情做对时有限支持。人生保持独立，不是永远拒绝别人，而是把判断放在阵营前面；支持某件对的事，不等于把自己交给那一伙人。,独立;阵营;判断
LAXAJH054,李敖笑傲江湖,066.司法黑暗又来啦.txt,司法黑暗又来啦,新证据出现，旧案就不该睡死,李敖在旧官司里继续提出新证据，说明案件判过不代表真相已经完结。人生面对旧事，不要迷信“已经过去”；只要新证据还能改变理解，旧案就有重新发光的可能。,证据;旧案;真相
LAXAJH055,李敖笑傲江湖,067.代友痛宰保险公司.txt,代友痛宰保险公司,谈责任，要从对方最在乎的信用切入,李敖代友与保险公司周旋时，抓住对方百年信用和在台湾应有的负责态度来谈。人生谈判不是只发怒，而要找到对方最不能丢的牌；抓住信用、名誉和责任，话才有分量。,谈判;信用;责任
LAXAJH056,李敖笑傲江湖,068.最丑陋的中国人“柏杨”.txt,最丑陋的中国人“柏杨”,受难叙事不能替事实免检,李敖反对把柏杨包装成地狱归来、坚持真理自由的人，而不检验具体事实。人生同情受难者，也不能因此停用判断；苦难值得尊重，但苦难叙事不能自动替一个人洗清所有问题。,受难;事实;判断
LAXAJH057,李敖笑傲江湖,071.厚道与真理.txt,厚道与真理,厚道不能压过真理,李敖在恩怨评论中区分私人厚道和公共真理，反对为了好看而不说实话。人生可以待人厚道，但不能拿厚道当真相的棉被；该讲清楚的是非若被温情盖住，最后会伤害更多人。,厚道;真理;是非
LAXAJH058,李敖笑傲江湖,074.为陈炯明翻案（上）.txt,为陈炯明翻案（上）,替污名者翻案，要先付材料成本,陈炯明长期被主流叙事打成叛徒，李敖却愿意重开历史公案。人生讲公道，不能只替热门好人鼓掌；若要为被污名者说话，就要先付出查证、举证和承受误解的成本。,翻案;污名;材料
LAXAJH059,李敖笑傲江湖,075.为陈炯明翻案（下）.txt,为陈炯明翻案（下）,追假史，要展示它怎样被改,李敖请陈定炎展示材料，说明历史如何被后来叙事改写。人生查真相，不只要说事实是什么，也要说明假话如何形成；把修改痕迹摆出来，别人才看得见造假的手法。,假史;改写;证据
LAXAJH060,李敖笑傲江湖,076.真话假话肉麻话.txt,真话假话肉麻话,剪掉关键话，就是背叛诚信,李敖批评电视台删掉他对蒋孝勇的关键话，不论出于讨好还是自以为厚道，都违反协议。人生合作时，最怕有人替你“善意修剪”核心内容；关键处被剪，完整性就被背叛了。,诚信;媒体;完整性
LAXAJH061,李敖笑傲江湖,078.老蒋不死，还有精神.txt,老蒋不死，还有精神,守历史，要同时防官方和群情,李敖说历史真相先被国民党污染，又可能被群众和各党继续污染。人生面对公共记忆，要防的不只是官方说法，也包括阵营情绪和复仇快感；历史不能谁喊得响谁改。,历史;群情;公正
LAXAJH062,李敖笑傲江湖,080.鸡毛蒜皮.txt,鸡毛蒜皮,敬畏记录，是防无耻的栏杆,李敖说古代坏皇帝至少还怕历史、清议和祖宗，现代有些统治者却什么都不怕。人生做事要留一点对记录和后评的敬畏；完全不怕被记下的人，常也不怕把事做绝。,记录;清议;敬畏
LAXAJH063,李敖笑傲江湖,081.不伐贼，王业亦亡.txt,不伐贼，王业亦亡,名篇也要接受版本审查,李敖谈《后出师表》是否可靠，提醒人不要因为文章有名就停止考证。人生读经典、听名言，都要保留版本意识；名声只能说明流传广，不能替来源和真伪盖章。,名篇;版本;考证
LAXAJH064,李敖笑傲江湖,082.求知的方法.txt,求知的方法,不知道，也是一种知道,李敖重解“知之为知之，不知为不知”，认为有些不属于自己范围的知识可以承认不知道。人生求知不是装作无所不知；知道自己的边界，懂得哪些该学、哪些可不必硬学，才是真正成熟。,求知;边界;诚实
LAXAJH065,李敖笑傲江湖,082.求知的方法.txt,求知的方法,趁注意力打开，把知识讲进去,李敖借三国热谈历史，称这是军中所谓“机会教育”：大家正关心时，知识才容易进去。人生传递知识，不必总等正式课堂；现实事件打开注意力的瞬间，就是讲清背景的好时机。,机会教育;注意力;知识
LAXAJH066,李敖笑傲江湖,083.李敖回忆录（上）.txt,李敖回忆录（上）,自述不是证据终点,李敖指出自传、回忆录常有假书和假话，尤其涉及个人形象时更要小心。人生读别人自述，不能因为第一人称就信以为真；自述只是线索起点，旁证才决定它能站多久。,自述;旁证;怀疑
LAXAJH067,李敖笑傲江湖,084.李敖回忆录（下）.txt,李敖回忆录（下）,真正的职业，会在沉寂中等你回来,李敖坐牢后长期不见人，沈登恩却判断他终会回来写作，因为写作是他的习惯和职业。人生若有真正扎根的本领，一时被隔绝也不会消失；它会在沉寂里等你重新开工。,职业;写作;沉寂
LAXAJH068,李敖笑傲江湖,085.西安事变六十周年（一）.txt,西安事变六十周年（一）,第一个替失势者说话，最不容易,李敖自称是最早替张学良说话的人之一，在权威叙事仍强时为他打开公道。人生讲真话，最难的是在大家还不敢讲时先讲；等舆论转向以后跟着说，胆量已经少了一半。,失势者;真话;胆量
LAXAJH069,李敖笑傲江湖,088.西安事变六十周年（四）.txt,西安事变六十周年（四）,精神自由不能拿来粉饰囚禁,张学良说身体自由不重要、精神自由重要，李敖对此感到难过，认为这不该遮住被关押的事实。人生可以在困境中保有精神自由，但不能用它替外在压迫涂脂抹粉；受压迫就是受压迫。,自由;囚禁;清醒
