id,book,source_file,source_chapter,wisdom_title,wisdom_text,theme_tags
LASDJ071,李敖送电集,033.2000年3月22日.txt,2000年3月22日,墓碑上写什么，才说明你真正看重什么,他提到杰斐逊墓碑不写总统，而写独立宣言、宗教自由法令和大学创办人。人生不要只被头衔牵着走；想想自己死后最愿被记住的三件事，很多眼前名位会立刻变轻。,价值;头衔;人生排序
LASDJ072,李敖送电集,033.2000年3月22日.txt,2000年3月22日,历史阶段要拆开，责任才不会混成一团,他把二二八分成几个阶段，说明不同时间、不同人的责任不能糊成一个标签。人生处理复杂事件，要先分阶段、分角色、分责任；一锅粥式的记忆只会方便宣传，不方便求真。,历史;阶段;责任
LASDJ073,李敖送电集,033.2000年3月22日.txt,2000年3月22日,异议声音的存在，本身就是公共价值,他说代表新党参选的重要意义，是让台湾还有人能讲真话、发出异议之声。人生和社会都需要不讨好人的声音；异议不一定马上胜利，但它让公共空间不至于只剩一种音调。,异议;公共;真话
LASDJ074,李敖送电集,034.2000年3月23日.txt,2000年3月23日,绕过管制，也可以靠形式创新,他回忆办《千秋评论》时，用每月准时出书的方式避开杂志登记和停刊处罚。人生遇到不合理限制，不一定只会硬撞；理解规则漏洞，用形式创新保住表达，也是一种聪明反抗。,形式创新;限制;表达
LASDJ075,李敖送电集,034.2000年3月23日.txt,2000年3月23日,冤案翻出来，常要先承受当事人的恐惧,他讲李友邦冤狱时说，公布过程艰苦，甚至家属一开始还怕被牵连。人生替别人翻案，不要以为对方一定立刻感激；长期恐惧会让人先求安全，做事者要理解这层压力。,冤案;恐惧;翻案
LASDJ076,李敖送电集,034.2000年3月23日.txt,2000年3月23日,名录不收你，不等于你不存在,他屡次被作家目录、名人录遗漏，反而借此说明制度性忽视的荒谬。人生被名单排除时，不必立刻怀疑自己的价值；名单常反映权力和偏见，作品与事实才是更长久的存在证明。,名录;忽视;价值
LASDJ077,李敖送电集,034.2000年3月23日.txt,2000年3月23日,光环越亮，越要账本照一照,他批评某些知识分子以清望和公益之名做不透明的事，认为“好人做坏事”十分危险。人生不要因为一个人名声好，就免除对他的监督；光环越亮，越需要制度和账本来照一照。,好人;监督;光环
LASDJ078,李敖送电集,035.2000年3月24日.txt,2000年3月24日,忘恩负义最容易发生在得势之后,他讲王企祥提携李远哲却后来被背书打击的故事，指出权势起来后容易反咬旧恩。人生看一个人的品格，不只看他落魄时多谦虚，更要看他得势后是否还承认旧人旧恩。,感恩;权势;品格
LASDJ079,李敖送电集,035.2000年3月24日.txt,2000年3月24日,清望一旦被拿去暗示投票，就不再清白,他批评李远哲用清高形象作政治暗示，却不明说责任。人生拥有名望时，每一次暧昧站队都会消耗信用；借清望影响别人，就必须承担相应的公共责任，不能一边左右选择，一边把自己包装成超然。,清望;责任;暧昧
LASDJ080,李敖送电集,036.2000年3月27日.txt,2000年3月27日,尊严要在小地方自己争回来,他在抽签时被对方用“中驷对上驷”，于是派副手回应，强调尊严不是等人给的。人生很多轻慢发生在小程序里；精细的人不会放过这些地方，因为尊严常常就是从小处被让掉或争回来的。,尊严;细节;主动
LASDJ081,李敖送电集,036.2000年3月27日.txt,2000年3月27日,打拼果实若不被记录，就会被后来者接收,他看彭明敏站在后排，感叹早年坐牢流亡者的果实被后来投机者接收。人生和组织都要记录谁真正付过代价；没有记录，后来最会站到前排的人，就会把前人的牺牲收割成自己的光环。,记录;贡献;收割
LASDJ082,李敖送电集,036.2000年3月27日.txt,2000年3月27日,主动选择严苛标准，会改变别人控制你的方式,他入狱后主动要求单独坐牢、半年不写信不见人，让管制者反而要来谈判。人生在被动局面中，有时主动选择更高标准，会打乱对方的惩罚逻辑；当你不怕他们准备用来吓你的东西，局势就会变。,逆境;主动;标准
LASDJ083,李敖送电集,036.2000年3月27日.txt,2000年3月27日,在限制里保存成果，要学会借对方流程运转,他在牢中写材料，表面写古代故事，暗中通过检查流程把真正文字运出去。人生面对严密限制，光有勇气不够，还要懂流程、懂伪装、懂借力；智慧是让对方规则反过来替你做事。,限制;流程;智慧
LASDJ084,李敖送电集,037.2000年3月28日.txt,2000年3月28日,道德教条一旦要求亲人陪葬，就该停下来怀疑,他讲守城杀妾、人吃人的故事，反问正义走到惨烈时与敌人还有何区别。人生坚持信念也要有人性底线；当一种道德要求你牺牲无辜亲人和普通人，它很可能已经从正义变成残忍。,道德;底线;人性
LASDJ085,李敖送电集,037.2000年3月28日.txt,2000年3月28日,老忠诚也要确认对象是否还存在,他提醒老党员所谓国民党已被偷天换日，投票给旧名可能已不是投给旧组织。人生长期忠诚某个组织、品牌或关系时，要定期确认它还是不是原来那个东西；名字还在，不等于灵魂还在。,忠诚;组织;辨认
LASDJ086,李敖送电集,038.2000年3月29日.txt,2000年3月29日,活出自己前，先认识影响自己的力量,他对少年说，离开管训环境后会遇到新朋友、新诱惑，重犯不全怪孩子，也要怪成人世界。人生想活出自己，不能只喊性格；先辨认家庭、朋友、书本、诱惑和制度怎样塑造你，才有可能真正选择。,自我;影响;成长
LASDJ087,李敖送电集,038.2000年3月29日.txt,2000年3月29日,错误的爱情故事会训练错误的爱情方法,他用琼瑶小说说明，若把恋爱看成哭哭啼啼的痛苦，就会带着错误观念进入爱情。人生的感情观不是凭空来的，常由看过的故事塑造；选择什么故事进入心里，就是在选择将来怎样爱人。,爱情;故事;观念
LASDJ088,李敖送电集,039.2000年3月30日.txt,2000年3月30日,真正的强，是胜过自己的欲望,他以自己戒酒戒烟、不靠咖啡茶等例子解释“自胜者强”。人生最难打败的常不是外部敌人，而是让自己反复失控的欲望；能管住自己，能让身体和习惯听命于判断，才有资格说强。,自胜;欲望;习惯
LASDJ089,李敖送电集,039.2000年3月30日.txt,2000年3月30日,一切靠自己觉悟，外在管训只能暂时有效,他讲周处除三害和流氓故事，强调真正改变要靠自己觉悟。人生被管、被教、被督促都只能撑一阵；如果没有从内部承认“第三害就是我自己”，改变就不会牢靠。,觉悟;改变;自我
LASDJ090,李敖送电集,040.2000年3月31日.txt,2000年3月31日,好习惯是在恶劣环境里救自己的工具,他对少年说，牢里也能写歌、写词、做有意义的事，真正救自己的方法是养成稳定的好习惯。人生环境不总好，但习惯可以成为随身工具；越在逆境里，越要培养能把自己拉回来的习惯。,习惯;逆境;自救
LASDJ091,李敖送电集,040.2000年3月31日.txt,2000年3月31日,力量小的人更要学会使用轻巧武器,他说王羽打人要用拳头，而自己能用文章、书和法律满足力量。人生不必把反击都想成硬碰硬；文字、证据、法律和公开表达，常是弱者更轻巧、更持久的武器。,文字;法律;反击
LASDJ092,李敖送电集,041.2000年4月3日.txt,2000年4月3日,坏人要做大也得有本事，何况做好人,他对少年说，真正高级的黑手党也要念书到一级棒，做坏人都不容易。人生别用“我不是读书料”替自己偷懒；世界上连坏事都需要能力，想做好事、成大事，更不能没有本领。,本领;努力;觉悟
LASDJ093,李敖送电集,041.2000年4月3日.txt,2000年4月3日,不是天才，也能靠方法变成自己要成为的人,他承认自己不是神童，成功靠后天方法和努力，慢慢克服个人缺点。人生不必把天才当入场券；找到方法、持续练习、修正缺点，也能把自己造成某种程度的成功者。,方法;努力;成功
LASDJ094,李敖送电集,042.2000年4月4日.txt,2000年4月4日,读书慎取，比读得多更要紧,他回答求学问的方法时说“慎取”最重要，不喜欢、无趣、错误的书不会带来好结果。人生读书不只是数量竞赛；一本书能不能吸引你、启发你、让你变清醒，比读了多少更关键。,读书;慎取;学问
LASDJ095,李敖送电集,043.2000年4月5日.txt,2000年4月5日,长期受苦后的补偿心理，要自己识别,他谈出狱后的补偿心理，认为长期失去自由的人容易想把失去的东西追回来。人生受过长期压抑后，最要小心报复性补偿；看见这个心理，才不至于让过去的苦继续指挥现在。,补偿心理;苦难;自知
LASDJ096,李敖送电集,043.2000年4月5日.txt,2000年4月5日,公共承诺要用正式文件追踪,他整理总统官邸巷道案，用记者会、法规、新闻稿和公文追踪陈水扁承诺如何变化。人生检验公共承诺，不要只靠记忆和愤怒；把正式文件一路排出来，才看得出谁在何时转弯。,承诺;文件;追踪
LASDJ097,李敖送电集,044.2000年4月6日.txt,2000年4月6日,安全理由必须有边界,他追问封巷事件中“总统及其家属安全”如何压过台北市民通行权。人生面对安全、效率、管理等大理由时，要问它有没有边界；没有边界的安全，常会把普通人的权利吃掉。,安全;公众权利;边界
LASDJ098,李敖送电集,045.2000年4月7日.txt,2000年4月7日,陈情要让对方逐项答复,林美伦就官邸封巷案列出具体问题，要求主管机关限期答复。人生提出投诉或陈情，不能只喊不满；把问题编号、依据列明、要求时限，对方才不容易用空话把你打发掉。,陈情;问题清单;追责
