id,book,source_file,source_chapter,wisdom_title,wisdom_text,theme_tags
LAFDJ069,李敖发电集,039.2000年1月24日.txt,2000年1月24日,分不清荣辱，就会把丢脸包装成荣耀,他批评受限制访美却称世纪之旅，认为这是把世纪之辱说成荣耀。人生最怕价值尺度坏掉：被羞辱还自我庆祝，被限制还说成成功；先分清荣辱，才不会在漂亮口号里失去尊严。,荣辱;尊严;判断
LAFDJ070,李敖发电集,039.2000年1月24日.txt,2000年1月24日,打不过就不要用姿态替实力撑场面,他反对明知打不过还喊打喊杀，认为这种鬼叫只会害人。人生面对强弱悬殊的局面，勇敢不是大声，而是准确估量实力、成本和退路；姿态不能替你挡灾，理性才可能保命。,实力;理性;姿态
LAFDJ071,李敖发电集,039.2000年1月24日.txt,2000年1月24日,误判对方性格，会把局面推向失控,他认为两岸头头都错估对方，李登辉不了解对方翻脸后不可收拾，对方也误判李登辉可谈。人生处理冲突，必须研究对方真实性格和底线；只按自己希望的对手来行动，最容易闯祸。,冲突;误判;性格
LAFDJ072,李敖发电集,040.2000年1月25日.txt,2000年1月25日,公开讲真话难，是因为群众也会惩罚诚实,他指出精英不是昏庸，就是没有胆识站出来说话，背后有民意和旧教育的压力。人生说真话的敌人不只权力，也包括围观者的情绪；若凡事只讨好听众，真相就会越来越少。,真话;群众;胆识
LAFDJ073,李敖发电集,040.2000年1月25日.txt,2000年1月25日,旧口号要定期清仓,他批评反共抗俄教育的阴魂不散，使社会继续享受旧口号的余荫。人生早年受过的口号和训练，会在很久以后仍替你反应；定期检查这些旧程序，才不会把过去的恐惧当成今天的常识。,口号;反省;旧教育
LAFDJ074,李敖发电集,041.2000年1月26日.txt,2000年1月26日,象征目标不能替代现实改善,他认为进联合国、国号等不务实目标，会让人民不断感受挫折、生产悲情。人生追求目标时，要分清象征满足和现实改善；把力气耗在虚幻名号上，常会让人既得不到好处，也走不出怨气。,务实;目标;现实
LAFDJ075,李敖发电集,041.2000年1月26日.txt,2000年1月26日,谈条件先亮出可交换的长处,他设想两岸谈判时，台湾可用成功经济力量争取财政、企业和管理空间。人生谈条件时，不要只抱怨别人不给面子；先看自己真正能贡献什么，再用这个长处去换角色、位置和发言权。,长处;谈判;位置
LAFDJ076,李敖发电集,042.2000年1月27日.txt,2000年1月27日,安全不能寄托在一个人的理智上,他以一条人命之隔谈国家安全，指出疯子与权力只隔接班或身体变故。人生设计制度和风险管理，不能假设关键人物永远清醒；把安全押在一个人的克制上，本身就是危险。,风险;制度;安全
LAFDJ077,李敖发电集,042.2000年1月27日.txt,2000年1月27日,危机中需要高明谈判者，不需要莽夫,他推崇塔列朗能在拿破仑闯祸后以弱胜强，为法国争回空间。人生遇到大危机，最需要的不是喊得最大声的人，而是懂局势、懂筹码、懂退让与反击的人；莽勇常把残局弄得更坏。,危机;谈判;智慧
LAFDJ078,李敖发电集,043.2000年1月28日.txt,2000年1月28日,爱之不当，反而会害了所爱之物,他借庄子混沌寓言说明热爱乡土要有正确方法，错误的爱会把对象弄死。人生爱一个人、地方或事业，不能只凭热情；方法错了，越用力越伤害，真正的爱必须带着知识和分寸。,热爱;方法;分寸
LAFDJ079,李敖发电集,043.2000年1月28日.txt,2000年1月28日,扣帽子会让真话从公共空间消失,他说一顶“不爱台湾”的帽子就能吓坏许多人，让大家不敢说真话。人生讨论公共问题，最坏的习惯就是给人贴恶名；标签一多，理性的人沉默，剩下的往往只是表态比赛。,标签;真话;公共
LAFDJ080,李敖发电集,043.2000年1月28日.txt,2000年1月28日,文化政策也要问实际效用,他批评小学母语政策开倒车，并用瑞士语言经验说明语言选择会卡住现实。人生保护文化不是喊口号，还要问学了以后能不能用、成本由谁承担、是否影响下一步发展；情感不能替代效用评估。,文化;效用;政策
LAFDJ081,李敖发电集,043.2000年1月28日.txt,2000年1月28日,单向方案不是方案,他批评邦联、联邦或访问大陆等政策，若对方根本不理，就只有内部宣传效果。人生提出方案时，要问真正相关的人会不会接受；只让自己阵营鼓掌的方案，往往解决不了现实问题。,方案;现实;可行性
LAFDJ082,李敖发电集,043.2000年1月28日.txt,2000年1月28日,真正维护现状的人，也需要发声机会,他说台湾还有许多头脑清醒、想维持现况保护安全的人，只是声音出不来。人生不要以为沉默者不存在；很多理性声音缺的不是判断，而是出口和胆量，给这些声音空间，局面才不会被极端垄断。,理性;声音;现状
LAFDJ083,李敖发电集,043.2000年1月28日.txt,2000年1月28日,争自由的人也可能在得势后背叛自由,他批评曾号称争取百分之百言论自由的人，却赞美封锁新闻的报纸。人生看一个人是否真信自由，不看广告词，而看他在自己得利时是否仍容许别人说话；自由最怕胜利后的遗忘。,自由;行动;检验
LAFDJ084,李敖发电集,044.2000年1月31日.txt,2000年1月31日,反叛要先确认自己是否还在掌心里,他对年轻人说，他们以为自己反叛，结果像孙悟空翻筋斗仍在如来掌中。人生不要太快满足于愤怒和姿态；真正的反叛，是看清谁规定了你的题目、语言和边界，然后设法跳出去。,反叛;自觉;边界
