id,book,source_file,source_chapter,wisdom_title,wisdom_text,theme_tags
GWSRNK057,给外省人难看,031.联想高希均的联想.txt,联想高希均的联想,简单秘诀常会掩盖复杂来路,高希均把美国小城的秩序归结为政府执法征税、人民守法纳税，李敖则提醒背后还有历史条件、地理环境、文化传统和政治伤害的差异。人生里越漂亮的一句话秘诀，越要问它省略了多少条件；把复杂问题压成一句口号，常是浅薄的开始。,复杂性;条件;判断
GWSRNK058,给外省人难看,031.联想高希均的联想.txt,联想高希均的联想,远方的优越感不能代替当下的责任,李敖不满海外学人一边享受美国小城，一边回台湾办杂志、演讲、结交权贵、指点病灶。人生中比较他处之美可以开眼界，但若只拿远方当优越感来源，而不承担本地的艰难和责任，批评就会显得轻飘。,责任;比较;旁观
GWSRNK059,给外省人难看,032.郑贞铭抄袭事件.txt,郑贞铭抄袭事件,抄袭后推给学生，不是道歉是脱身,郑贞铭被指抄袭后，说成学生论文和编辑误会，李敖细列来信、告发、和解与声明，显示这种解释的闪躲。人生中犯错后的第一反应最见人格；把责任推给学生、助理、编辑这些更弱的位置，不但不能洗清自己，还会把错误变得更难看。,抄袭;责任;脱身
GWSRNK060,给外省人难看,032.郑贞铭抄袭事件.txt,郑贞铭抄袭事件,教新闻自由的人，先要让学生看见自由,文化大学新闻系学生批评郑贞铭不教学、不研究，还干预实习刊物，李敖把这作为新闻教育的反证。人生里教育最有力的课本是老师本人；你在课堂上讲自由、道德、操守，学生却在制度里看见删稿和压制，所有漂亮教材都会失效。,教育;身教;新闻自由
GWSRNK061,给外省人难看,033.丁中江捏造名单.txt,丁中江捏造名单,替权力补造证据，比单纯奉承更坏,丁中江把蒋介石列入日本陆军士官学校名单，李敖认为这不是普通吹捧，而是代权力捏造可查证的历史。人生中奉承已经可鄙，替对方补做证据更危险；一旦马屁进入名册、档案和书本，后人就要花更多力气清除它。,伪证;奉承;历史
GWSRNK062,给外省人难看,034.怎可告姨妈？.txt,怎可告姨妈？,明知亲属事实还翻案，是让利益压倒人情,胡之光明知父亲纪念集中列有姨妈和四个妹妹，却因遗产纠纷告曾广仙伪造文书，李敖因此谴责近亲不认。人生中家族关系最怕利益一来就重写记忆；若白纸黑字的旧事实都能为财产让路，人情就不只是淡了，而是被出卖了。,亲情;利益;事实
GWSRNK063,给外省人难看,034.怎可告姨妈？.txt,怎可告姨妈？,判断不能只靠常情，还要拿得出证据,法院用常情判断曾广仙无罪，李敖说若是他，会直接举《纪念集》中的家祭文和子女名单为证。人生中常情可以指路，却不能替证据完成工作；真正扎实的判断，要把直觉落到可核验的材料上。,证据;判断;常情
GWSRNK064,给外省人难看,035.从雷震日记看吴心柳伪造学历.txt,从雷震日记看吴心柳伪造学历,众口一声的学历，也要回到人事名册,张继高被许多名人录写成燕京大学新闻系毕业，李敖却查中央社职员名册和学校名称，指出其中矛盾。人生中一个说法被重复得多，不等于已经被证明；越是众口一声，越要回到最早、最接近事实现场的记录。,学历;名册;查证
GWSRNK065,给外省人难看,035.从雷震日记看吴心柳伪造学历.txt,从雷震日记看吴心柳伪造学历,连书名都在借光时，伪装已经深入生活,李敖注意到张继高书名《未名集》似乎借燕京未名湖之光，认为连著作命名都成了伪造学历的道具。人生里一个谎若只说一次，还可能是虚荣；若连名片、书名、履历、公共称呼都围着它转，就说明人已经开始为谎言布置生活。,伪装;虚荣;生活细节
GWSRNK066,给外省人难看,036.傅正的正负.txt,傅正的正负,盖棺论定要敢把正负两面都写上,傅正死后，李敖既肯定他早年在《自由中国》的表现和受难，也批评他晚年处理雷震遗稿与政治活动的失分。人生中真正的纪念不是只剩哀荣，也不是趁死后清算；把一个人的光和影都讲清，才是对历史负责。,评价;纪念;正负并列
GWSRNK067,给外省人难看,036.傅正的正负.txt,傅正的正负,抗议前先找准真正责任对象,雷震案后援活动冲向监察院，李敖却指出焚毁回忆录的责任链在军人监狱、军法处、警备总部和国防部。人生中愤怒要有方向，找错对象的抗议会把正义变成表演；真正负责任的追究，先把责任链画清楚。,追责;责任链;抗议
GWSRNK068,给外省人难看,036.傅正的正负.txt,傅正的正负,整理别人遗产，不要抹掉真正冒险的人,李敖强调胡虚一在危险时期为雷震保存、整理、刊布文件的功劳，却在后来的全集工程中被吸收或边缘化。人生里接手前人遗产，最忌在安全时期收割名义，却忘掉危险时期出力的人；公道首先是把功劳放回该在的位置。,功劳;公道;文化遗产
GWSRNK069,给外省人难看,037.我看林正杰还是先打倒自己吧！.txt,我看林正杰还是先打倒自己吧！,喊打倒别人以前，先检查自己的私利,林正杰喊着打倒两党，李敖却追问他曾在两党中时为何不打倒，指出今天的激烈也可能只是私利换位。人生中越响亮的正义口号，越要先问自己在其中得失如何；若立场总随个人位置改变，口号再硬也像生意。,口号;私利;自省
GWSRNK070,给外省人难看,037.我看林正杰还是先打倒自己吧！.txt,我看林正杰还是先打倒自己吧！,真正的强，不是胜人而是克己,李敖借老子“胜人者有力，自胜者强”，把矛头转回林正杰本人，要求先打倒自己的反复和作秀。人生中最容易的是把敌人列出来，最困难的是把自己身上的同类毛病清掉；不能克己的人，即使胜人，也只是在重复旧问题。,克己;自省;强者
