id,book,source_file,source_chapter,wisdom_title,wisdom_text,theme_tags
GWSRNK001,给外省人难看,001.蒋介石冒充日本士官学校毕业.txt,蒋介石冒充日本士官学校毕业,履历越显赫，越要怕查名册,李敖追查蒋介石所谓日本士官学校学历，不满足于传记中的神气描写，而是回到留学生名册、同学会记录和口述回忆逐项核对。人生里越是被包装成显赫的履历，越不能只看宣传文字；真正的底气经得起名单、时间和地点的检验，假的光环则常怕一张原始表格。,履历;证据;求真
GWSRNK002,给外省人难看,001.蒋介石冒充日本士官学校毕业.txt,蒋介石冒充日本士官学校毕业,自卑的人才急着给出身镀金,李敖指出蒋介石已经身居高位，却仍要把振武学校说成士官学校，把原本可以交代清楚的早年经历吹成更高学历。人生里真正成熟的人，不靠篡改起点来维持尊严；越急着把过去镀金，越暴露现在的虚弱。,自卑;真实;履历
GWSRNK003,给外省人难看,002.陈立夫的新谎话.txt,陈立夫的新谎话,否认派系时，先查他有没有自露过底,陈立夫把CC说成中共硬扣出来的虚名，李敖却引蒋君章记载，指出陈立夫自己曾在陈布雷面前用CC口吻给别人归类。人生中遇到一个人否认旧关系、旧派系、旧身份，不要只听他今天的声明；最要紧的是找他在放松、防备不严或同圈人面前说过什么，人的底常在不经意处露出来。,否认;证据;身份
GWSRNK004,给外省人难看,003.郝柏村还在无耻歌颂“民族救星”.txt,郝柏村还在无耻歌颂“民族救星”,自封的头衔最怕留下原迹,李敖用蒋介石亲笔口号反证“民族救星”的来源，指出许多后来被追捧成公共称号的东西，起初可能只是当事人自己指定的光环。人生里听见过度神圣的头衔，不妨追到最早出处；如果赞美原来出自自封，再多人复读也不能把它洗成事实。,头衔;自封;原始证据
GWSRNK005,给外省人难看,004.梁肃戎的悲哀.txt,梁肃戎的悲哀,苦难经历不能替后来失格免罪,梁肃戎年轻时冒险抗日、受难坐牢，李敖并不抹杀；但他同时指出，后来为做官而同流合污，仍然值得责备。人生中早年的牺牲可敬，却不能成为后来放弃原则的永久护身符；真正难的是把受难时的自己一路保存到得势以后。,经历;原则;晚节
GWSRNK006,给外省人难看,004.梁肃戎的悲哀.txt,梁肃戎的悲哀,官越做越大，人不能越活越小,李敖说梁肃戎的悲哀不在感谢提拔，而在不再是自己。人生里最危险的升迁，是职位一级级变高，内心却一层层缩小；真正的成就不是让名片变厚，而是让人在权位里还保有原来的勇气和声音。,升迁;自我;勇气
GWSRNK007,给外省人难看,005.陶百川的无耻.txt,陶百川的无耻,十年沉默不能靠一次求情洗白,陶百川把自己替彭家说情写成美德，李敖却追问他在多年非法监管中为何不早说话。人生中偶尔一次善意不能抵消长期沉默，尤其当你原本有位置、有责任、有能力发声时；迟来的帮忙若不承认旧日怯懦，就容易变成自我表扬。,沉默;责任;自省
GWSRNK008,给外省人难看,005.陶百川的无耻.txt,陶百川的无耻,由独裁者决定不要特权，仍是独裁,陶百川称赞蒋经国反对增订诽谤总统罪，李敖却指出，国家立法竟可由总统一句话决定，本身就暴露了独裁结构。人生里不要被一个温和决定迷住眼睛，还要看决定是怎样产生的；若制度仍靠某个人恩准，哪怕这次结果较好，也不能算真正的自由和法治。,制度;法治;权力结构
GWSRNK009,给外省人难看,006.成舍我诱奸怨妇打胎三次.txt,成舍我诱奸怨妇打胎三次,立身有示范作用，私德也会变公评,李敖评成舍我时，特别指出教育界人士的立身有典范作用，因此吝啬、负义、背盟都不能只说成私事。人生里一个人越以道德、教育、公共职位示人，越不能把自己的行为藏进“私生活”里；你要求社会尊重你的身份，也就接受了社会检验你的品行。,私德;公评;示范
GWSRNK010,给外省人难看,006.成舍我诱奸怨妇打胎三次.txt,成舍我诱奸怨妇打胎三次,评价人要能分出长处和亏欠,李敖揭成舍我的负面行径后，仍补上一句该肯定的长处还是要肯定。人生中严厉批评不等于把人抹黑成一团，真正公允的判断既不因一善遮百恶，也不因一恶废尽其余；能分账，才不容易被爱憎拖着走。,评价;公允;分寸
GWSRNK011,给外省人难看,007.徐复观是好汉吗？.txt,徐复观是好汉吗？,影射别人，也要准备认账,徐复观用化名、影射、转述来骂人，到了法庭又试图把指向变得含糊，李敖因此把问题落在“骂了人不要想赖账”。人生里语言若故意让读者知道你在指谁，就不能在追责时假装自己没有指向；暗箭最见心术，认账才有最起码的光明。,语言责任;影射;认账
GWSRNK012,给外省人难看,007.徐复观是好汉吗？.txt,徐复观是好汉吗？,崇拜人物前先看他敢不敢承认小事,有人称徐复观有大儒风骨，李敖却从他不肯承认骂人这件小事切入，判断所谓诚实勇敢是否站得住。人生中检验一个人的品格，不必总等惊天动地的大场面；一件白纸黑字的小责任，他若都要闪躲，大话里的风骨就很可疑。,品格;小事;风骨
GWSRNK013,给外省人难看,008.无耻的蒋彦士为姘头的妈做干儿子.txt,无耻的蒋彦士为姘头的妈做干儿子,传统若只剩名分，最容易被现实掏空,李敖借义子、义婿、收养传统一路推演，指出口口声声复兴文化的人，常在现实关系里把名分弄到荒唐。人生中使用传统名义时，要问它背后有没有真实伦理支撑；若只是拿旧词遮新私情，传统反而成了笑话。,传统;名分;真实关系
GWSRNK014,给外省人难看,008.无耻的蒋彦士为姘头的妈做干儿子.txt,无耻的蒋彦士为姘头的妈做干儿子,双轨生活会把人训练得安之若素,文中谈中国人一面讲经典规定，一面在事实上照样收养异姓之子，形成阳奉阴违的双轨生活。人生里最要警惕的不是偶尔破例，而是长期把两套标准过成习惯；一旦虚伪也能安之若素，人就会失去对荒唐的敏感。,双轨;虚伪;敏感
GWSRNK015,给外省人难看,009.给宋长志先生上一课.txt,给宋长志先生上一课,理解制度要追到历史病根,李敖赞许许荣淑把军政、军令两分的历史源流讲清楚，因为只从眼前法条看，常会看浅了问题。人生里处理制度性麻烦，不能只问今天谁说了什么，还要追问这个结构从哪里来、曾经造成什么灾难；找到病根，才知道该怎么治。,制度;历史;病根
GWSRNK016,给外省人难看,009.给宋长志先生上一课.txt,给宋长志先生上一课,专业训练越单一，越要接受外部节制,李敖借德国、日本、美国军政关系，说明军人专业虽强，却不适合脱离文官和国会控制。人生里越是训练高度单一的领域，越需要外部视角提醒它的盲点；专业能力不是免受监督的理由，反而常是需要监督的理由。,专业;监督;权力边界
GWSRNK017,给外省人难看,009.给宋长志先生上一课.txt,给宋长志先生上一课,一百分的专业人也可能是不及格的管理者,李敖说宋长志可能是考一百分的军人，却是不及格的国防部长，关键在岗位性质已经变了。人生中不要把一个场域里的优秀自动搬到另一个场域；换了位置，就换了责任、知识结构和判断尺度，原来的强项可能正是新的短板。,岗位;专业边界;管理
GWSRNK018,给外省人难看,010.警告钱复，不可“丧权辱国”！.txt,警告钱复，不可“丧权辱国”！,越专业的谈判越不能一把抓,面对中美著作权谈判，李敖反感少数人秘密作业、把相关部会排除在外，因为专业不足不能成为集中决策的借口。人生中复杂谈判最怕少数聪明人自以为灵活；真正稳妥的策略，往往来自公开检验、分工准备和足够多的专业追问。,谈判;专业;公开检验
GWSRNK019,给外省人难看,010.警告钱复，不可“丧权辱国”！.txt,警告钱复，不可“丧权辱国”！,弱小时保留工具，不是永远拒绝规则,李敖谈翻译权时指出，落后国家曾靠开放翻译、翻印取得新知，美国自己也有相似历史。人生里讲规则要看阶段和条件，弱小时把所有工具过早交出，可能不是高尚而是短视；成长以后再调整规则，才比较不至于用漂亮名义锁死自己。,策略;发展;规则
GWSRNK020,给外省人难看,011.给李达海上一课.txt,给李达海上一课,制度设计错了，换人只能换出新毛病,李达海抱怨监察委员产生方式和兼职生意，李敖却把问题推到监察院这种制度设计本身。人生里遇到反复失灵的组织，不要只盯着这次是谁坏、谁蠢；如果结构注定让人卷入党争和利益，换一批人也可能只是换一种坏法。,制度设计;组织;根本问题
GWSRNK021,给外省人难看,011.给李达海上一课.txt,给李达海上一课,不要用古代招牌掩护现代失灵,监察院自称师承古代监察制度，李敖却提醒古代御史本来就是统治者耳目，容易卷入争宠和党争。人生里继承传统制度或方法，不能只看招牌古老、名义庄严，还要问它原本服务谁、会带来什么副作用；古意不能自动变成正当性。,传统制度;功能;正当性
GWSRNK022,给外省人难看,012.敲回谢然之的龟头！.txt,敲回谢然之的龟头！,背叛成习惯的人，回忆也要打折看,谢然之一路见风转舵，后来又写文章追忆蒋经国，李敖因此把他的回忆放回他自己的投靠史、出走史和更正信里检验。人生中听人怀念旧主、赞美旧事，要先看他说话者是否一贯可靠；一个长期靠转向自保的人，很难突然变成诚实的见证人。,回忆;可靠性;投机
GWSRNK023,给外省人难看,013.邵玉铭与军阀.txt,邵玉铭与军阀,无法公开的禁令，本身就在自证心虚,邵玉铭用秘密公文要求警察处理书籍，李敖抓住“秘密”二字指出它见不得人。人生里一个决定若必须躲在暗处执行，常说明它经不起公开理由的检验；真正正当的规则，不该怕被当事人和公众看见。,公开;规则;心虚
GWSRNK024,给外省人难看,013.邵玉铭与军阀.txt,邵玉铭与军阀,放松名义下的加码，最值得警惕,文章说解严以后本应减少管制，却出现用其他法令继续禁书的手法。人生中不要只看制度名称变得温和，关键要看实际约束有没有变少；若旧工具失效后又找新工具补上，所谓开放只是换了包装。,开放;管制;换包装
GWSRNK025,给外省人难看,014.宋楚瑜该入什么传？.txt,宋楚瑜该入什么传？,把人才当奴才，最后只能把奴才当人才,李敖批评蒋氏父子的人才政策，从不会尊重真才，滑到只会重用宠臣。人生中领导者若习惯把有能力的人降格为听话工具，久而久之，真正有骨头的人会离开，只剩会逢迎的人被误当栋梁。,人才;领导;宠臣
GWSRNK026,给外省人难看,015.马英九的马屁言论.txt,马英九的马屁言论,学术场合最怕把研究做成颂词,马英九在所谓学术讨论会上写蒋经国论文，李敖批评它充满不实的马屁，把压制文化、言论和迁徙自由的历史改写成建设与改革。人生里研究和颂词要分清：研究必须让事实有机会反驳对象，若先把结论献给权力，再搜材料装饰，学术场合就只剩仪式感。,学术;颂词;事实
GWSRNK027,给外省人难看,015.马英九的马屁言论.txt,马英九的马屁言论,改革诚意要看救济有没有兑现,李敖抓住解严后军事审判案件能否上诉，指出口头放宽若剥夺实际救济，就是换汤不换药。人生中判断改革，不要只听宣示和口号，要看受害者能不能补救、权利能不能恢复、旧账能不能重审；不能落到这些地方的诚意，多半只是表演。,改革;救济;兑现
GWSRNK028,给外省人难看,016.王又曾涉嫌诈财物案.txt,王又曾涉嫌诈财物案,组织栽培出来的人，反映组织的眼光,李敖从王又曾被撤销参选资格追到旧案旧履历，认为国民党长期重视和栽培这样的人，本身就是人才政策的问题。人生里一个团体不能只在成员出事后切割，他被谁提拔、怎样上位、为何被包装，都在说明这个团体真正奖励什么。,组织;用人;眼光
GWSRNK029,给外省人难看,016.王又曾涉嫌诈财物案.txt,王又曾涉嫌诈财物案,名人录越漂亮，越要查它漏掉了什么,王又曾在名人录里被写成杰出企业家，李敖却把舞厅生意和诈财物案找出来对照。人生中履历文字最会选择性发光，读它时要问被省略的经历是什么；一个人真正的信用，常藏在简历不愿写出的那几页。,履历;遗漏;信用
GWSRNK030,给外省人难看,017.吴祺芳的“内线交易”.txt,吴祺芳的“内线交易”,离开岗位也不能带走岗位秘密,吴祺芳卸任后公开谈政府施政方针，李敖据公务员保密义务指为政治上的内线交易。人生中职位给你的消息，不会因为你离职就自动变成私人资本；把旧岗位的信息拿去为新位置加分，是对边界的背叛。,职业边界;保密;公私
GWSRNK031,给外省人难看,017.吴祺芳的“内线交易”.txt,吴祺芳的“内线交易”,公家资源一旦住进私心，就很难退租,李敖追问吴祺芳住官邸八年，把“看管房子”的理由拆成公款、租约、职位便利和私人享受。人生里公私界线常不是一夜崩坏，而是从一个看似方便的理由开始；只要私心住进公家资源，后面就会有无数解释替它续租。,公私;资源;自肥
GWSRNK032,给外省人难看,018.孔德成父子是破坏中国考试制度的祸首.txt,孔德成父子是破坏中国考试制度的祸首,掌管考试的人更该先受考试约束,孔德成自己从未考试，却出任考试院长，并为儿子争取免试入学，李敖把这看成对考试制度的破坏。人生中越是站在规则管理位置，越不能替自己和家人开例外；规则若先在守门人家里失效，就很难再要求别人相信公平。,规则;公平;考试
GWSRNK033,给外省人难看,019.钱穆的房事与家事.txt,钱穆的房事与家事,越讲义理，越要在利益上干净,钱穆长期住公产住宅，又接受特殊探亲安排，李敖因此反问一个讲天理人欲的学者为何乐于玩法。人生里越常谈道德、义利和圣贤，越要在房子、钱、特权这些具体利益上守清楚；抽象高论抵不过一件公私不分的小事。,义利;公私;学者
GWSRNK034,给外省人难看,019.钱穆的房事与家事.txt,钱穆的房事与家事,法外施仁不能只施给有名的人,文中多次出现以礼遇大师、人道精神为名的法外安排，李敖怀疑为什么玩法的便利总落在特定名人头上。人生中同情和宽大若没有普遍标准，就会变成特权；真正的仁厚不能只在权势和名望面前突然醒来。,特权;宽大;公平
GWSRNK035,给外省人难看,020.老毛是国特？.txt,老毛是国特？,朋友受难后接替他的位子，最见薄情,毛子水在《自由中国》停刊后出面办国民党安排的新杂志，李敖把这看成见利忘友的士林败相。人生里朋友或同道被压垮时，你可以沉默、可以避祸，但若转身接过压迫者给的新位子，就不只是自保，而是在别人的伤口上升迁。,友情;背义;升迁
GWSRNK036,给外省人难看,020.老毛是国特？.txt,老毛是国特？,文章写得雅，也可能是在替恶行上妆,毛子水为特务头子写墓志铭，把暴力机构说成护卫正义，李敖因此不看文辞漂亮，只看被美化的事实是什么。人生中最危险的文字不一定粗暴，有时正是典雅、庄重、文言化的赞辞，把血腥和权力包装得像品德。,文字;美化;事实
GWSRNK037,给外省人难看,021.李济的内行与外行.txt,李济的内行与外行,学问内行不等于办学内行,李敖承认李济作为学者够格，却否定他在推动研究、培养人才上的功劳。人生里某项专业做得好，不代表适合领导整个生态；能研究和能成全别人研究，是两种能力，混为一谈就会让内行的名声遮住管理的外行。,学术;领导;能力边界
GWSRNK038,给外省人难看,021.李济的内行与外行.txt,李济的内行与外行,资源被少数人把持，学问也会窒息,李敖批评学阀把持资料、职位和机构资源，使研究不能开放发展。人生中任何领域只要把关键资料锁在少数人手里，就会从专业共同体变成私家仓库；真正的学术和事业，都需要让资源流动、让新人进入。,资源;学阀;开放
GWSRNK039,给外省人难看,022.李济、许倬云怎样拿钱不办事.txt,李济、许倬云怎样拿钱不办事,拿了钱的计划，不能永远停在今年完成,李敖沿着王世杰日记追查《中国上古史》一拖多年，看到一次次承诺“今年完成”都落空。人生中接受资源就接受了期限和交付责任；若长期拿钱、开会、允诺，却不给成果，漂亮计划就会变成有经费的拖延。,承诺;期限;交付
GWSRNK040,给外省人难看,022.李济、许倬云怎样拿钱不办事.txt,李济、许倬云怎样拿钱不办事,没人负责的大工程最会吞时间,《中国上古史》由委员会、院长、秘书和执笔人层层分散，最后谁都像有责任，谁都没有真正完成。人生里越大的工程，越需要明确的负责人、里程碑和退出机制；责任若被组织名义稀释，时间会被它无声吃掉。,项目;责任;组织
GWSRNK041,给外省人难看,023.从许倬云逼婚谄上看国民党学人品格.txt,从许倬云逼婚谄上看国民党学人品格,同情弱点不能取消品格检验,李敖写许倬云的残疾遭遇时，并不把个人困境直接等同为人格免检。人生中面对有苦难或弱点的人，应该有同情，但同情不能变成不许追问其行为；苦难解释人的一部分处境，却不能替所有跋扈、谄媚和伤人免罪。,同情;品格;边界
GWSRNK042,给外省人难看,023.从许倬云逼婚谄上看国民党学人品格.txt,从许倬云逼婚谄上看国民党学人品格,士大夫词汇不能替良知作证,许倬云被赞为有社会良知、士大夫传统，李敖却拿他对权贵的谀词和私下行为来对照。人生中判断一个知识分子，不要被“天下为己任”“谋道不谋食”这些大词催眠；大词要落实到具体选择，否则只是给顺从权力穿上文化长袍。,知识分子;良知;大词
GWSRNK043,给外省人难看,024.许翼云许倬云哥俩好无耻！.txt,许翼云许倬云哥俩好无耻！,风向安全以后才开口，不算风骨,许倬云在张学良时来运转后才说出过去不敢说的话，李敖讥为见风转舵。人生里说真话的价值，常取决于它说出的时机；等到危险消失、利益换边以后才显得清醒，那不是勇敢，而是把迟到包装成见识。,时机;风骨;投机
GWSRNK044,给外省人难看,025.吴大猷假公济私的一面.txt,吴大猷假公济私的一面,私人纠纷一动用公文，味道就变了,吴大猷与出版社的著作争议，本可按私人法律关系处理，却由公家机关秘书室发函催问，李敖因此抓住假公济私。人生中判断一件事是否越界，不妨看私人不满有没有借用公家抬头、人员和压力；一旦公器替私怨跑腿，正当性就先输了一半。,公器私用;边界;纠纷
GWSRNK045,给外省人难看,025.吴大猷假公济私的一面.txt,吴大猷假公济私的一面,公家出版物不是私人文集的便车,李敖批评吴大猷把许多与物理本行无关、取媚当道的文章放进公家机构出版物。人生里资源来自公共位置，就要服务公共职务；若把公家平台当私人文集和政治表态的便车，名义越学术，私心越刺眼。,出版;公私;学术资源
GWSRNK046,给外省人难看,025.吴大猷假公济私的一面.txt,吴大猷假公济私的一面,别听人自称粗枝大叶，要看他在哪里精细,吴大猷说自己不耐细节，李敖却从控告、发函、取媚座次等细节看出他并非不会精细，而是把精细用在了有利处。人生中评价一个人，不能只听他的自我形容；真正的性格，常显现在他最计较、最会安排、最不肯放松的地方。,识人;细节;自我包装
GWSRNK047,给外省人难看,026.沈君山的政治酒窝，笑笑！.txt,沈君山的政治酒窝，笑笑！,言论自由的真相，要看同一句话谁说,沈君山说了许多别人说不得的话却平安无事，李敖由此揭出国民党对自己人和党外人士的双重标准。人生里判断一个环境有没有自由，不只看某些话能不能出现，还要看同样的话由弱者、外人、无背景者说出来会怎样。,言论自由;双重标准;背景
GWSRNK048,给外省人难看,026.沈君山的政治酒窝，笑笑！.txt,沈君山的政治酒窝，笑笑！,有背景的人看起来勇敢，常是因为有人兜底,李敖把沈君山的宽松待遇放到家庭、派系和关系网里解释，提醒所谓敢言有时不是个人胆识，而是特权保护。人生中不要轻易把安全位置上的冒险误认为英雄气；真正的勇敢，要看没有护栏时还敢不敢承担同样后果。,特权;勇敢;关系网
GWSRNK049,给外省人难看,027.从丘宏达考试作弊看国民党学人品格.txt,从丘宏达考试作弊看国民党学人品格,曲学阿世最坏，是把知识变成统治工具,丘宏达用学术包装替戒严寻找替代办法，李敖称之为曲学阿世。人生中知识最可怕的堕落，不只是说错话，而是明知权力要逃避批评，还替它设计更漂亮的名义；学问一旦专门帮强者换包装，就会伤害后来的世界。,学术;权力;曲学阿世
GWSRNK050,给外省人难看,027.从丘宏达考试作弊看国民党学人品格.txt,从丘宏达考试作弊看国民党学人品格,换掉坏名声不等于换掉坏制度,所谓用国家安全法取代戒严法，李敖看成保留戒严之实、免背戒严之名的戏法。人生里许多改革只是在处理名声，不是在处理伤害；看懂一项改变，要问被限制的人有没有真的自由，而不是掌权者有没有更好听的招牌。,换汤不换药;制度;名义
GWSRNK051,给外省人难看,028.从林毓生捏造文证看国民党学人品格.txt,从林毓生捏造文证看国民党学人品格,回忆读过什么书，也要经得起版本和时间检验,林毓生回忆少年时代在琉璃厂读买胡适书，李敖从出版社、版本、书名和年代逐项拆解。人生里不要以为读书回忆只是风雅小事，知识分子的可信度正体现在这些可查的细节上；连自己启蒙故事都要编，别的大话更要小心。,读书;回忆;可考
GWSRNK052,给外省人难看,028.从林毓生捏造文证看国民党学人品格.txt,从林毓生捏造文证看国民党学人品格,小文证能照出大品格,李敖说林毓生的错误事情不大，却足以见微知著，因为捏造文证反映的是一种自炫和不诚实。人生中别轻忽小证据的失真；小地方敢乱编的人，在大问题上未必突然严谨，品格常先从不起眼的注脚里漏出来。,文证;诚实;见微知著
GWSRNK053,给外省人难看,029.国民党别乱捧苏雪林啦！.txt,国民党别乱捧苏雪林啦！,热闹祝寿不能替人盖棺定论,苏雪林生日被官方和学界大捧，李敖偏要把她前后拥鲁反鲁、改文、冒名索书等细节摆出来。人生里纪念场合最容易让人只说好话，但热闹不是结论；越是众口一声，越需要有人把不合场面的事实放回桌上。,纪念;事实;逆风判断
GWSRNK054,给外省人难看,029.国民党别乱捧苏雪林啦！.txt,国民党别乱捧苏雪林啦！,前后改口可以，但别偷偷改证据,李敖指出苏雪林对鲁迅、胡适、李敖的态度多次变化，甚至在收文时修改旧文字。人生中思想转变并不可耻，可耻的是不承认转变，还把旧证据悄悄改成对自己有利的样子；诚实的人可以换看法，不能偷换自己的来路。,一致性;证据;转变
GWSRNK055,给外省人难看,030.余光中该烧哪只手？.txt,余光中该烧哪只手？,契约要按全篇精神读，不要抓一句逃账,余光中以未注明年限为由否认出版权让渡，李敖则把契约标题、独家、全部稿酬、不得不利发行、执照保管等条款连起来看。人生中签约后的争议，不能只挑一个缝隙替自己脱身；真正守信的人，会按当初整体意思认账。,契约;守信;整体解释
GWSRNK056,给外省人难看,030.余光中该烧哪只手？.txt,余光中该烧哪只手？,对方倒霉不是你撕约的机会,文星书店被勒令停业后，一些作者趁它停摆，把原已让渡的出版权另卖他人，李敖把这看成斯文扫地。人生中检验契约精神，常不在双方都顺利的时候，而在对方失势、受压、暂时不能说话的时候；趁人倒霉改口，赚到的是便宜，赔掉的是人格。,契约;落井下石;人格
